"biosphere","id","river","site","weather","other_weather","start_comment","dissolved_oxygen_ppm","dissolved_oxygen_percent","time","nitrate","phosphate","salinity_ppt","salinity_percent","tds","electrical_conductivity","ph","irrigation_suitability","air_temperature","latitude","longitude","altitude_m","location_accuracy_m","datetime","date","flag_ph","flag_do_ppm","flag_do_percent","flag_ec","flag_temp","any_flag"
"Kruger 2 Canyons BR","Kubjaname Site 3","Kubjaname","Site 3","partly_cloudy","","",NA,224.7,"03/13/2024 09:10",NA,NA,NA,NA,NA,73.3,8.11,"pH reading indicates the water is suitable for irrigation",26.8,-24.3023617,30.5052232,622.8,4.8,2024-03-13 09:10:00,2024-03-13,FALSE,FALSE,TRUE,FALSE,FALSE,TRUE
"Kruger 2 Canyons BR","Olifants Site 1","Olifants","Site 1","light_rain","","",NA,146.7,"03/14/2024 08:08",NA,NA,NA,NA,NA,199,8.59,"pH reading indicates the water is NOT suitable for irrigation",26.3,-24.3617467,30.6586133,467.4,4.1,2024-03-14 08:08:00,2024-03-14,FALSE,FALSE,FALSE,FALSE,FALSE,FALSE
"Kruger 2 Canyons BR","Moetladimo Site 1","Moetladimo","Site 1","cloudy","","",NA,125.7,"03/19/2024 07:52",NA,NA,NA,NA,NA,47.5,8.19,"pH reading indicates the water is suitable for irrigation",25.3,-24.2587219,30.4538698,610.2,3.814,2024-03-19 07:52:00,2024-03-19,FALSE,FALSE,FALSE,FALSE,FALSE,FALSE
"Vhembe BR","Levubu River Lambani site 1","Levubu River","Lambani site 1","sunny","","",3.34,43.2,"06/21/2024 10:51",NA,NA,NA,NA,NA,128.6,7.91,"pH reading indicates the water is suitable for irrigation",18,-22.74556,30.8843583,391.7,5,2024-06-21 10:51:00,2024-06-21,FALSE,FALSE,FALSE,FALSE,FALSE,FALSE
"Kruger 2 Canyons BR","Moetladimo Site 1","Moetladimo","Site 1","cloudy","","",NA,125.7,"03/19/2024 08:17",NA,NA,NA,NA,NA,47.5,8.19,"pH reading indicates the water is suitable for irrigation",25.3,-24.2587219,30.4538698,610.2,3.814,2024-03-19 08:17:00,2024-03-19,FALSE,FALSE,FALSE,FALSE,FALSE,FALSE
"Kruger 2 Canyons BR","Moetladimo Site 1","Moetladimo","Site 1","cloudy","","",NA,125.7,"03/19/2024 08:20",NA,NA,NA,NA,NA,47.5,8.19,"pH reading indicates the water is suitable for irrigation",25.3,-24.2587219,30.4538698,610.2,3.814,2024-03-19 08:20:00,2024-03-19,FALSE,FALSE,FALSE,FALSE,FALSE,FALSE
"Vhembe BR","Levubu River Mulenzhe Site 1","Levubu River","Mulenzhe Site 1","cloudy","","",1.29,13.1,"06/24/2024 09:28",NA,NA,NA,NA,NA,53.8,8.42,"pH reading indicates the water is suitable for irrigation",18.1,-22.9710764,30.6038104,442.5,4.84,2024-06-24 09:28:00,2024-06-24,FALSE,FALSE,FALSE,FALSE,FALSE,FALSE
"Kruger 2 Canyons BR","Moetladimo Site 2","Moetladimo","Site 2","cloudy","","",NA,131.5,"03/19/2024 08:42",NA,NA,NA,NA,NA,48,7.85,"pH reading indicates the water is suitable for irrigation",24.8,-24.2516824,30.452053,603,3.966,2024-03-19 08:42:00,2024-03-19,FALSE,FALSE,FALSE,FALSE,FALSE,FALSE
"Kruger 2 Canyons BR","Moetladimo Site 3","Moetladimo","Site 3","cloudy","","",NA,118.2,"03/19/2024 23:31",NA,NA,NA,NA,NA,51.1,7.72,"pH reading indicates the water is suitable for irrigation",25.5,-24.2469356,30.4552699,603,4.857,2024-03-19 23:31:00,2024-03-19,FALSE,FALSE,FALSE,FALSE,FALSE,FALSE
"Vhembe BR","Levubu River Mulenzhe site 1","Levubu River","Mulenzhe site 1","cloudy","","",1.29,13.1,"06/24/2024 09:28",NA,NA,NA,NA,NA,53.8,8.42,"pH reading indicates the water is suitable for irrigation",18.1,-22.97116014,30.60378286,490.3941682,4.9,2024-06-24 09:28:00,2024-06-24,FALSE,FALSE,FALSE,FALSE,FALSE,FALSE
"Kruger 2 Canyons BR","Kubjaname Site 1","Kubjaname","Site 1","cloudy","","",NA,142.5,"03/20/2024 08:02",NA,NA,NA,NA,NA,44.3,7.81,"pH reading indicates the water is suitable for irrigation",24.6,-24.3044421,30.5049648,627.4,4.933,2024-03-20 08:02:00,2024-03-20,FALSE,FALSE,FALSE,FALSE,FALSE,FALSE
"Kruger 2 Canyons BR","Kubjaname Site 2","Kubjaname","Site 2","cloudy","","",NA,134,"03/20/2024 08:32",NA,NA,NA,NA,NA,76.3,7.84,"pH reading indicates the water is suitable for irrigation",24.8,-24.3035641,30.5046637,618.9,4.75,2024-03-20 08:32:00,2024-03-20,FALSE,FALSE,FALSE,FALSE,FALSE,FALSE
"Kruger 2 Canyons BR","Kubjaname Site 3","Kubjaname","Site 3","cloudy","","",NA,NA,"03/20/2024 09:33",NA,NA,NA,NA,NA,78,7.76,"pH reading indicates the water is suitable for irrigation",24.9,-24.3022944,30.5052766,616.5,4.86,2024-03-20 09:33:00,2024-03-20,FALSE,FALSE,FALSE,FALSE,FALSE,FALSE
"Vhembe BR","Levubu River Lambani site 2","Levubu River","Lambani site 2","cloudy","","",2.59,31.7,"06/24/2024 09:42",NA,NA,NA,NA,NA,171.7,8.28,"pH reading indicates the water is suitable for irrigation",17,-22.7275375,30.8853367,418.8,4.28,2024-06-24 09:42:00,2024-06-24,FALSE,FALSE,FALSE,FALSE,FALSE,FALSE
"Vhembe BR","Levubu River Lambani site 2","Levubu River","Lambani site 2","cloudy","","",2.39,31.7,"06/24/2024 09:44",NA,NA,NA,NA,NA,171.7,8.28,"pH reading indicates the water is suitable for irrigation",17,-22.7275631,30.8852822,414.4,3.385,2024-06-24 09:44:00,2024-06-24,FALSE,FALSE,FALSE,FALSE,FALSE,FALSE
"Kruger 2 Canyons BR","Kubjaname Site 1","Kubjaname","Site 1","cloudy","","",NA,NA,"04/03/2024 08:22",NA,NA,NA,NA,NA,63,7.86,"pH reading indicates the water is suitable for irrigation",22.2,-24.3044996,30.5051705,633.2,4.84,2024-04-03 08:22:00,2024-04-03,FALSE,FALSE,FALSE,FALSE,FALSE,FALSE
"Kruger 2 Canyons BR","Kubjaname Site 2","Kubjaname","Site 2","cloudy","","",NA,NA,"04/03/2024 08:51",NA,NA,NA,NA,NA,64.2,7.83,"pH reading indicates the water is suitable for irrigation",22.5,-24.3036076,30.5046911,624.2,4.885,2024-04-03 08:51:00,2024-04-03,FALSE,FALSE,FALSE,FALSE,FALSE,FALSE
"Kruger 2 Canyons BR","Kubjaname Site 3","Kubjaname","Site 3","cloudy","","",NA,NA,"04/03/2024 09:30",NA,NA,NA,NA,NA,66.3,8.36,"pH reading indicates the water is suitable for irrigation",23,-24.3022576,30.5052802,626,4,2024-04-03 09:30:00,2024-04-03,FALSE,FALSE,FALSE,FALSE,FALSE,FALSE
"Kruger 2 Canyons BR","Olifants Site 1","Olifants","Site 1","partly_cloudy","","",NA,108.2,"04/04/2024 22:19",NA,NA,NA,NA,NA,191.1,8.62,"pH reading indicates the water is NOT suitable for irrigation",24.4,-24.3614433,30.6586433,472.2,4,2024-04-04 22:19:00,2024-04-04,FALSE,FALSE,FALSE,FALSE,FALSE,FALSE
"Kruger 2 Canyons BR","Olifants Site 1","Olifants","Site 1","cloudy","","",NA,121.1,"04/11/2024 23:33",NA,NA,NA,NA,NA,166,8.45,"pH reading indicates the water is suitable for irrigation",22.2,-24.3617038,30.6586178,466.2,4.88,2024-04-11 23:33:00,2024-04-11,FALSE,FALSE,FALSE,FALSE,FALSE,FALSE
"Kruger 2 Canyons BR","Moetladimo Site 1","Moetladimo","Site 1","cloudy","","",NA,103.9,"04/16/2024 08:57",NA,NA,NA,NA,NA,49,8.54,"pH reading indicates the water is NOT suitable for irrigation",22.1,-24.2587595,30.4539247,615,4.875,2024-04-16 08:57:00,2024-04-16,FALSE,FALSE,FALSE,FALSE,FALSE,FALSE
"Kruger 2 Canyons BR","Olifants Site 3","Olifants","Site 3","cloudy","","",NA,108,"04/17/2024 07:50",NA,NA,NA,NA,NA,48.3,8.16,"pH reading indicates the water is suitable for irrigation",22.2,-24.2469848,30.4553306,602.7000122,4.75,2024-04-17 07:50:00,2024-04-17,FALSE,FALSE,FALSE,FALSE,FALSE,FALSE
"Kruger 2 Canyons BR","Kubjaname Site 1","Kubjaname","Site 1","cloudy","","",NA,111.7,"04/17/2024 08:21",NA,NA,NA,NA,NA,53.2,8.24,"pH reading indicates the water is suitable for irrigation",19.9,-24.3043983,30.5049299,626.8,4.22,2024-04-17 08:21:00,2024-04-17,FALSE,FALSE,FALSE,FALSE,FALSE,FALSE
"Kruger 2 Canyons BR","Kubjaname Site 2","Kubjaname","Site 2","cloudy","","",NA,117.4,"04/17/2024 08:50",NA,NA,NA,NA,NA,53.8,7.64,"pH reading indicates the water is suitable for irrigation",20.4,-24.303539,30.504737,634.6,4.4,2024-04-17 08:50:00,2024-04-17,FALSE,FALSE,FALSE,FALSE,FALSE,FALSE
"Kruger 2 Canyons BR","Kubjaname Site 3","Kubjaname","Site 3","partly_cloudy","","",NA,112,"04/17/2024 09:27",NA,NA,NA,NA,NA,52.4,7.19,"pH reading indicates the water is suitable for irrigation",21.6,-24.3022687,30.5052104,604,3.9,2024-04-17 09:27:00,2024-04-17,FALSE,FALSE,FALSE,FALSE,FALSE,FALSE
"Vhembe BR","Levubu River Luvuvhu01","Levubu River","Luvuvhu01","partly_cloudy","","Training day data capture",1.58,20.3,"04/16/2024 12:52",NA,NA,NA,NA,NA,231,8.29,"pH reading indicates the water is suitable for irrigation",26.1,-22.9712118,30.6038091,485,5,2024-04-16 12:52:00,2024-04-16,FALSE,FALSE,FALSE,FALSE,FALSE,FALSE
"Vhembe BR","Levubu River Luvuvhu01","Levubu River","Luvuvhu01","sunny","","",1.06,13,"04/19/2024 09:54",NA,NA,NA,NA,NA,138,7.6,"pH reading indicates the water is suitable for irrigation",26.6,-23.0540986,30.2969119,660.1850586,4.621,2024-04-19 09:54:00,2024-04-19,FALSE,FALSE,FALSE,FALSE,FALSE,FALSE
"Vhembe BR","Levubu River Luvuvhu 03","Levubu River","Luvuvhu 03","sunny","","Normal sunny day",0.45,6.3,"04/22/2024 09:21",NA,NA,NA,NA,NA,120.4,6.44,"pH reading indicates the water is NOT suitable for irrigation",23.8,-22.7455781,30.8841773,397.7,4.825,2024-04-22 09:21:00,2024-04-22,FALSE,FALSE,FALSE,FALSE,FALSE,FALSE
"Vhembe BR","Levubu River Luvuvhu03","Levubu River","Luvuvhu03","sunny","","Just a normal sunny day",0.45,6.3,"04/22/2024 09:20",NA,NA,NA,NA,NA,120.4,6.44,"pH reading indicates the water is NOT suitable for irrigation",23.8,-22.74556,30.8842101,435.7,5,2024-04-22 09:20:00,2024-04-22,FALSE,FALSE,FALSE,FALSE,FALSE,FALSE
"Vhembe BR","Levubu River Luvuvhu03","Levubu River","Luvuvhu03","sunny","","Just Normal sunny day",0.45,6.3,"04/22/2024 09:21",NA,NA,NA,NA,NA,120.4,6.44,"pH reading indicates the water is NOT suitable for irrigation",23.8,-22.7455667,30.8841501,425.1,4.666,2024-04-22 09:21:00,2024-04-22,FALSE,FALSE,FALSE,FALSE,FALSE,FALSE
"Vhembe BR","Tshakhuma01 Tshakhuma001","Tshakhuma01","Tshakhuma001","sunny","","",0.9,11,"04/23/2024 09:12",NA,NA,NA,NA,NA,109.3,7.36,"pH reading indicates the water is suitable for irrigation",24.5,-23.0529576,30.2965128,650,5,2024-04-23 09:12:00,2024-04-23,FALSE,FALSE,FALSE,FALSE,FALSE,FALSE
"Vhembe BR","Levubu River Luvuvhu01","Levubu River","Luvuvhu01","sunny","","Mulenzhe sampling day 1",2.56,30.45,"04/23/2024 10:38",NA,NA,NA,NA,NA,147.2,8.28,"pH reading indicates the water is suitable for irrigation",23,-22.9711889,30.6037713,467.3,4.858,2024-04-23 10:38:00,2024-04-23,FALSE,FALSE,FALSE,FALSE,FALSE,FALSE
"Vhembe BR","Levubu River Luvuvhu01","Levubu River","Luvuvhu01","sunny","","Mulenzhe sampling day 1",2.56,30.4,"04/23/2024 10:11",NA,NA,NA,NA,NA,147.2,8.28,"pH reading indicates the water is suitable for irrigation",23,-22.97125501,30.60377605,476.8295899,4.9,2024-04-23 10:11:00,2024-04-23,FALSE,FALSE,FALSE,FALSE,FALSE,FALSE
"Kruger 2 Canyons BR","Kubjaname Site 2","Kubjaname","Site 2","cloudy","","",NA,175.9,"04/24/2024 09:01",NA,NA,NA,NA,NA,61.6,8.78,"pH reading indicates the water is NOT suitable for irrigation",22.8,-24.3035983,30.5046533,613.2,4.7,2024-04-24 09:01:00,2024-04-24,FALSE,FALSE,FALSE,FALSE,FALSE,FALSE
"Vhembe BR","Levubu River Levubu03","Levubu River","Levubu03","sunny","","Just normal day",7.59,116.9,"04/26/2024 07:07",NA,NA,NA,NA,NA,120,7.14,"pH reading indicates the water is suitable for irrigation",24.3,-22.7455416,30.8842272,460,4.533,2024-04-26 07:07:00,2024-04-26,FALSE,FALSE,FALSE,FALSE,FALSE,FALSE
"Vhembe BR","Levubu River Luvuvhu 2 site 2","Levubu River","Luvuvhu 2 site 2","partly_cloudy","","",2.16,26.1,"04/26/2024 15:11",NA,NA,NA,NA,NA,54.5,7.84,"pH reading indicates the water is suitable for irrigation",24,-22.97173981,30.60343732,501.6345828,4.9,2024-04-26 15:11:00,2024-04-26,FALSE,FALSE,FALSE,FALSE,FALSE,FALSE
"Vhembe BR","Levubu River Luvuvhu 2 site 2","Levubu River","Luvuvhu 2 site 2","partly_cloudy","","",2.16,26.1,"04/26/2024 15:00",NA,NA,NA,NA,NA,54.5,7.84,"pH reading indicates the water is suitable for irrigation",24,-22.9717356,30.6034394,496.1,4.58,2024-04-26 15:00:00,2024-04-26,FALSE,FALSE,FALSE,FALSE,FALSE,FALSE
"Vhembe BR","Levubu River Luvuvhu 1 Site 2","Levubu River","Luvuvhu 1 Site 2","partly_cloudy","","Mulenzhe Village Sampling Day",2.16,26.1,"04/26/2024 15:12",NA,NA,NA,NA,NA,64.5,7.84,"pH reading indicates the water is suitable for irrigation",24.1,-22.97165197,30.60342238,483.1174316,3.902548,2024-04-26 15:12:00,2024-04-26,FALSE,FALSE,FALSE,FALSE,FALSE,FALSE
"Vhembe BR","Levubu River Luvuvhu 1 site 1","Levubu River","Luvuvhu 1 site 1","partly_cloudy","","",2.04,22.8,"04/29/2024 09:52",NA,NA,NA,NA,NA,150.1,7.85,"pH reading indicates the water is suitable for irrigation",21.5,-22.97123668,30.60378697,511.5958684,4.9,2024-04-29 09:52:00,2024-04-29,FALSE,FALSE,FALSE,FALSE,FALSE,FALSE
"Vhembe BR","Levubu River Luvuvhu 2 site 1","Levubu River","Luvuvhu 2 site 1","partly_cloudy","","",2.04,22.8,"04/29/2024 10:03",NA,NA,NA,NA,NA,150.1,7.85,"pH reading indicates the water is suitable for irrigation",21.5,-22.9711643,30.6037935,553.6000366,4.46,2024-04-29 10:03:00,2024-04-29,FALSE,FALSE,FALSE,FALSE,FALSE,FALSE
"Vhembe BR","Levubu River Luvhuvhu 2 Site 1","Levubu River","Luvhuvhu 2 Site 1","partly_cloudy","","We found people performing spiritual activities.",2.04,22.8,"04/29/2024 09:54",NA,NA,NA,NA,NA,150.1,7.85,"pH reading indicates the water is suitable for irrigation",21.5,-22.97113478,30.60374109,484.0995483,4.8786755,2024-04-29 09:54:00,2024-04-29,FALSE,FALSE,FALSE,FALSE,FALSE,FALSE
"Vhembe BR","Levubu River Luvuvhu03","Levubu River","Luvuvhu03","sunny","","",3.59,10,"04/29/2024 12:18",NA,NA,NA,NA,NA,87,7.46,"pH reading indicates the water is suitable for irrigation",21.2,-22.7274964,30.8852695,447.8,4.898,2024-04-29 12:18:00,2024-04-29,FALSE,FALSE,FALSE,FALSE,FALSE,FALSE
"Kruger 2 Canyons BR","Kubjaname Site 1","Kubjaname","Site 1","cloudy","","",NA,205,"04/24/2024 08:32",NA,NA,NA,NA,NA,59.4,8.17,"pH reading indicates the water is suitable for irrigation",22.9,-24.3044033,30.5048984,617.9,3.9,2024-04-24 08:32:00,2024-04-24,FALSE,FALSE,TRUE,FALSE,FALSE,TRUE
"Kruger 2 Canyons BR","Moetladimo Site 1","Moetladimo","Site 1","sunny","","",NA,230.2,"04/30/2024 08:21",NA,NA,NA,NA,NA,49.7,7.12,"pH reading indicates the water is suitable for irrigation",20.8,-24.258717,30.453923,617.1000366,4.26,2024-04-30 08:21:00,2024-04-30,FALSE,FALSE,TRUE,FALSE,FALSE,TRUE
"Kruger 2 Canyons BR","Moetladimo Moe2 Alt 1","Moetladimo","Moe2 Alt 1","sunny","","",NA,173.8,"04/30/2024 09:06",NA,NA,NA,NA,NA,48.5,8.28,"pH reading indicates the water is suitable for irrigation",20.6,-24.251785,30.4516067,599.8,4.1,2024-04-30 09:06:00,2024-04-30,FALSE,FALSE,FALSE,FALSE,FALSE,FALSE
"Vhembe BR","Levubu River Luvuvhu 2 site 2","Levubu River","Luvuvhu 2 site 2","sunny","","",18.8,21.8,"04/30/2024 09:04",NA,NA,NA,NA,NA,150.8,7.72,"pH reading indicates the water is suitable for irrigation",21.1,-22.97168468,30.60341554,479.4799532,4.9,2024-04-30 09:04:00,2024-04-30,FALSE,FALSE,FALSE,FALSE,FALSE,FALSE
"Kruger 2 Canyons BR","Olifants Site 1","Olifants","Site 1","sunny","","",NA,130.6,"05/02/2024 08:29",NA,NA,NA,NA,NA,221,10.21,"pH reading indicates the water is NOT suitable for irrigation",20.1,-24.3617419,30.6586376,492.7,4.766,2024-05-02 08:29:00,2024-05-02,TRUE,FALSE,FALSE,FALSE,FALSE,TRUE
"Vhembe BR","Levubu River Tshakhuma2","Levubu River","Tshakhuma2","cloudy","","",0.72,8.5,"05/03/2024 08:40",NA,NA,NA,NA,NA,93.2,7.95,"pH reading indicates the water is suitable for irrigation",22.1,-23.0529804,30.2966029,664,4.15,2024-05-03 08:40:00,2024-05-03,FALSE,FALSE,FALSE,FALSE,FALSE,FALSE
"Vhembe BR","Levubu River Tshakhuma1","Levubu River","Tshakhuma1","sunny","","",0.72,9.3,"05/07/2024 09:37",NA,NA,NA,NA,NA,107.3,7.99,"pH reading indicates the water is suitable for irrigation",22.6,-23.0540487,30.2969263,642,3.9,2024-05-07 09:37:00,2024-05-07,FALSE,FALSE,FALSE,FALSE,FALSE,FALSE
"Kruger 2 Canyons BR","Moetladimo Site 3","Moetladimo","Site 3","sunny","","",NA,206,"05/07/2024 10:15",NA,NA,NA,NA,NA,46.2,11.99,"pH reading indicates the water is NOT suitable for irrigation",21.3,-24.2469517,30.4553787,603.500061,4.6,2024-05-07 10:15:00,2024-05-07,TRUE,FALSE,TRUE,FALSE,FALSE,TRUE
"Kruger 2 Canyons BR","Moetladimo Moe Alt 2","Moetladimo","Moe Alt 2","sunny","","",NA,170,"05/07/2024 08:46",NA,NA,NA,NA,NA,46.5,8.66,"pH reading indicates the water is NOT suitable for irrigation",21.5,-24.2518156,30.4517699,603.500061,4.7,2024-05-07 08:46:00,2024-05-07,FALSE,FALSE,FALSE,FALSE,FALSE,FALSE
"Kruger 2 Canyons BR","Moetladimo Site 1","Moetladimo","Site 1","sunny","","",NA,178.5,"05/07/2024 08:20",NA,NA,NA,NA,NA,48.2,7.88,"pH reading indicates the water is suitable for irrigation",21.3,-24.2587087,30.4538996,607.4,4.775,2024-05-07 08:20:00,2024-05-07,FALSE,FALSE,FALSE,FALSE,FALSE,FALSE
"Vhembe BR","Levubu River Halambani site 1","Levubu River","Halambani site 1","sunny","","Today we have water pump machine operating so it may affect the results due to sound  oil spill n e.t.c",0.05,0.7,"05/07/2024 13:02",NA,NA,NA,NA,NA,121.7,7.6,"pH reading indicates the water is suitable for irrigation",23.3,-22.7456053,30.884258,447.3,3.9,2024-05-07 13:02:00,2024-05-07,FALSE,FALSE,FALSE,FALSE,FALSE,FALSE
"Kruger 2 Canyons BR","Marakalala Site 1","Marakalala","Site 1","sunny","","",NA,16.9,"05/09/2024 11:58",NA,NA,NA,NA,NA,230,6.96,"pH reading indicates the water is suitable for irrigation",19.6,-24.522804,30.7073257,840.8,4.8,2024-05-09 11:58:00,2024-05-09,FALSE,FALSE,FALSE,FALSE,FALSE,FALSE
"Kruger 2 Canyons BR","Marakalala Site 1","Marakalala","Site 1","sunny","","",NA,16.9,"05/09/2024 11:58",NA,NA,NA,NA,NA,230,6.96,"pH reading indicates the water is suitable for irrigation",19.6,-24.52272672,30.70726187,854.7638524,4.9,2024-05-09 11:58:00,2024-05-09,FALSE,FALSE,FALSE,FALSE,FALSE,FALSE
"Vhembe BR","Levubu River Tshakhuma2","Levubu River","Tshakhuma2","sunny","","",0.73,8.5,"05/10/2024 08:56",NA,NA,NA,NA,NA,102,7.39,"pH reading indicates the water is suitable for irrigation",21.6,-23.0528453,30.2965282,648,4.46,2024-05-10 08:56:00,2024-05-10,FALSE,FALSE,FALSE,FALSE,FALSE,FALSE
"Kruger 2 Canyons BR","Moetladimo Site 1","Moetladimo","Site 1","sunny","","",NA,165.3,"05/14/2024 08:30",NA,NA,NA,NA,NA,43,8.12,"pH reading indicates the water is suitable for irrigation",20.8,-24.25876,30.453865,617.1000366,4.3,2024-05-14 08:30:00,2024-05-14,FALSE,FALSE,FALSE,FALSE,FALSE,FALSE
"Vhembe BR","Levubu River Mulenzhe site 1","Levubu River","Mulenzhe site 1","light_rain","","",2.36,27.5,"05/14/2024 10:07",NA,NA,NA,NA,NA,153.9,8.12,"pH reading indicates the water is suitable for irrigation",21.6,-22.97119151,30.60376555,493.1382308,4.9,2024-05-14 10:07:00,2024-05-14,FALSE,FALSE,FALSE,FALSE,FALSE,FALSE
"Vhembe BR","Levubu River Luvuvhu 2 site 2","Levubu River","Luvuvhu 2 site 2","sunny","","",18.8,21.8,"04/30/2024 09:03",NA,NA,NA,NA,NA,150.8,7.72,"pH reading indicates the water is suitable for irrigation",21.1,-22.9717067,30.6034319,475.7,4.72,2024-04-30 09:03:00,2024-04-30,FALSE,FALSE,FALSE,FALSE,FALSE,FALSE
"Vhembe BR","Levubu River Mulenzhe Site 1","Levubu River","Mulenzhe Site 1","light_rain","","",2.36,27.5,"05/14/2024 10:06",NA,NA,NA,NA,NA,153.9,8.12,"pH reading indicates the water is suitable for irrigation",21.6,-22.9712109,30.6038488,474.4,5,2024-05-14 10:06:00,2024-05-14,FALSE,FALSE,FALSE,FALSE,FALSE,FALSE
"Kruger 2 Canyons BR","Moetladimo Moe3 Atl 1","Moetladimo","Moe3 Atl 1","partly_cloudy","","",NA,187.7,"05/14/2024 10:15",NA,NA,NA,NA,NA,55.7,7.99,"pH reading indicates the water is suitable for irrigation",21.1,-24.24725,30.455325,601.7,4.4,2024-05-14 10:15:00,2024-05-14,FALSE,FALSE,FALSE,FALSE,FALSE,FALSE
"Vhembe BR","Levubu River Halambani site 2","Levubu River","Halambani site 2","partly_cloudy","","Little bit rainy in the morning",0.3,4.2,"05/14/2024 13:47",NA,NA,NA,NA,NA,81.2,8.32,"pH reading indicates the water is suitable for irrigation",22.3,-22.727473,30.8853142,401.8,4.583,2024-05-14 13:47:00,2024-05-14,FALSE,FALSE,FALSE,FALSE,FALSE,FALSE
"Vhembe BR","Levubu River Lambani site 2","Levubu River","Lambani site 2","partly_cloudy","","It was raining in the morning  but by the time of our sampling it was partly clouds",0.3,4.2,"05/14/2024 13:50",NA,NA,NA,NA,NA,81.2,8.32,"pH reading indicates the water is suitable for irrigation",22.3,-22.7275524,30.8852983,424.2,3.22,2024-05-14 13:50:00,2024-05-14,FALSE,FALSE,FALSE,FALSE,FALSE,FALSE
"Kruger 2 Canyons BR","Moetladimo Moe Alt 2","Moetladimo","Moe Alt 2","sunny","","",NA,172.5,"05/14/2024 09:21",NA,NA,NA,NA,NA,51.3,8.07,"pH reading indicates the water is suitable for irrigation",21.9,-24.2517778,30.4516808,593.6,4.866,2024-05-14 09:21:00,2024-05-14,FALSE,FALSE,FALSE,FALSE,FALSE,FALSE
"Kruger 2 Canyons BR","Kubjaname Site 1","Kubjaname","Site 1","light_rain","","",NA,182.7,"05/15/2024 08:39",NA,NA,NA,NA,NA,89.2,7.96,"pH reading indicates the water is suitable for irrigation",20.8,-24.304475,30.5049433,619.8,3.9,2024-05-15 08:39:00,2024-05-15,FALSE,FALSE,FALSE,FALSE,FALSE,FALSE
"Kruger 2 Canyons BR","Mohlatsengwana Site 1","Mohlatsengwana","Site 1","partly_cloudy","","",NA,NA,"05/15/2024 09:43",NA,NA,NA,NA,NA,385,7.81,"pH reading indicates the water is suitable for irrigation",18.3,-24.5519061,30.6754376,867.8,5,2024-05-15 09:43:00,2024-05-15,FALSE,FALSE,FALSE,FALSE,FALSE,FALSE
"Kruger 2 Canyons BR","Mohlatsengwana Site 2","Mohlatsengwana","Site 2","partly_cloudy","","",NA,NA,"05/15/2024 11:08",NA,NA,NA,NA,NA,340,7.96,"pH reading indicates the water is suitable for irrigation",19.7,-24.5395049,30.6893005,852.6,4.775,2024-05-15 11:08:00,2024-05-15,FALSE,FALSE,FALSE,FALSE,FALSE,FALSE
"Kruger 2 Canyons BR","Mohlatsengwana Site 3","Mohlatsengwana","Site 3","partly_cloudy","","",NA,NA,"05/15/2024 12:21",NA,NA,NA,NA,NA,361,7.96,"pH reading indicates the water is suitable for irrigation",19.2,-24.540576,30.6954677,862,4.8,2024-05-15 12:21:00,2024-05-15,FALSE,FALSE,FALSE,FALSE,FALSE,FALSE
"Kruger 2 Canyons BR","Marakalala Site 1","Marakalala","Site 1","sunny","","",NA,NA,"05/16/2024 09:06",NA,NA,NA,NA,NA,236,6.68,"pH reading indicates the water is suitable for irrigation",17.2,-24.522776,30.7072552,849.1,4.7,2024-05-16 09:06:00,2024-05-16,FALSE,FALSE,FALSE,FALSE,FALSE,FALSE
"Kruger 2 Canyons BR","Olifants Site 1","Olifants","Site 1","sunny","","",NA,175,"05/16/2024 08:33",NA,NA,NA,NA,NA,246,8.64,"pH reading indicates the water is NOT suitable for irrigation",19,-24.3616184,30.6585743,443.8,4.95,2024-05-16 08:33:00,2024-05-16,FALSE,FALSE,FALSE,FALSE,FALSE,FALSE
"Vhembe BR","Levubu River Tshakhuma1","Levubu River","Tshakhuma1","sunny","","",0.67,7.7,"05/16/2024 09:05",NA,NA,NA,NA,NA,125.5,7.97,"pH reading indicates the water is suitable for irrigation",22.4,-23.0540919,30.2969937,660,4.515,2024-05-16 09:05:00,2024-05-16,FALSE,FALSE,FALSE,FALSE,FALSE,FALSE
"Kruger 2 Canyons BR","Marakalala Site 2","Marakalala","Site 2","sunny","","",NA,NA,"05/16/2024 10:17",NA,NA,NA,NA,NA,460,7.45,"pH reading indicates the water is suitable for irrigation",19.1,-24.5267083,30.71954,825.5,4.8,2024-05-16 10:17:00,2024-05-16,FALSE,FALSE,FALSE,FALSE,FALSE,FALSE
"Vhembe BR","Levubu River Lambani site 2","Levubu River","Lambani site 2","partly_cloudy","","Raining in the morning",0.3,4.2,"05/14/2024 13:52",NA,NA,NA,NA,NA,81.2,8.32,"pH reading indicates the water is suitable for irrigation",22.3,-22.7604798,30.8956448,0,4400,2024-05-14 13:52:00,2024-05-14,FALSE,FALSE,FALSE,FALSE,FALSE,FALSE
"Kruger 2 Canyons BR","Moetladimo Site 1","Moetladimo","Site 1","sunny","","",NA,120.43,"06/25/2024 10:30",NA,NA,NA,NA,NA,115.3,8.39,"pH reading indicates the water is suitable for irrigation",18.8,-24.2587333,30.4537717,625.5,5,2024-06-25 10:30:00,2024-06-25,FALSE,FALSE,FALSE,FALSE,FALSE,FALSE
"Vhembe BR","Levubu River Halambani site 2","Levubu River","Halambani site 2","sunny","","Just a normal day",0.63,8.7,"05/16/2024 13:34",NA,NA,NA,NA,NA,86.1,7.83,"pH reading indicates the water is suitable for irrigation",22.5,-22.7274652,30.8853118,421.1,4.933,2024-05-16 13:34:00,2024-05-16,FALSE,FALSE,FALSE,FALSE,FALSE,FALSE
"Kruger 2 Canyons BR","Marakalala Site 2","Marakalala","Site 2","sunny","","",NA,NA,"05/16/2024 18:37",NA,NA,NA,NA,NA,460,7.45,"pH reading indicates the water is suitable for irrigation",19.1,-24.5267083,30.71954,825.5,4.8,2024-05-16 18:37:00,2024-05-16,FALSE,FALSE,FALSE,FALSE,FALSE,FALSE
"Vhembe BR","Lambani site 2 No site name given","Lambani site 2","No site name given","sunny","","Just Normal day",0.63,8.7,"05/16/2024 13:28",NA,NA,NA,NA,NA,86.1,7.83,"pH reading indicates the water is suitable for irrigation",22.5,-22.7274566,30.8853631,432.7,4.55,2024-05-16 13:28:00,2024-05-16,FALSE,FALSE,FALSE,FALSE,FALSE,FALSE
"Vhembe BR","Levubu River Mulenzhe site 2","Levubu River","Mulenzhe site 2","sunny","","",1.71,20.3,"05/17/2024 09:31",NA,NA,NA,NA,NA,152.8,7.93,"pH reading indicates the water is suitable for irrigation",20.4,-22.9716285,30.6034577,488.9,4.82,2024-05-17 09:31:00,2024-05-17,FALSE,FALSE,FALSE,FALSE,FALSE,FALSE
"Vhembe BR","Levubu River Mulenzhe site 2","Levubu River","Mulenzhe site 2","sunny","","",1.71,20.3,"05/17/2024 09:31",NA,NA,NA,NA,NA,152.8,7.93,"pH reading indicates the water is suitable for irrigation",20.4,-22.97173389,30.60339581,480.5162826,4.9,2024-05-17 09:31:00,2024-05-17,FALSE,FALSE,FALSE,FALSE,FALSE,FALSE
"Vhembe BR","Levubu River Halambani site 1","Levubu River","Halambani site 1","sunny","","",0.45,6.2,"05/20/2024 11:00",NA,NA,NA,NA,NA,124.6,7.76,"pH reading indicates the water is suitable for irrigation",21,-22.7454815,30.8844887,431.9,4.7,2024-05-20 11:00:00,2024-05-20,FALSE,FALSE,FALSE,FALSE,FALSE,FALSE
"Vhembe BR","Levubu River Halambani site 1","Levubu River","Halambani site 1","sunny","","Sun rise",0.45,6.2,"05/20/2024 11:11",NA,NA,NA,NA,NA,124.6,7.76,"pH reading indicates the water is suitable for irrigation",21,-22.7454559,30.8844413,430.5,4.825,2024-05-20 11:11:00,2024-05-20,FALSE,FALSE,FALSE,FALSE,FALSE,FALSE
"Vhembe BR","Levubu River Ha lambani site 2","Levubu River","Ha lambani site 2","sunny","","Just normal day",0.63,8.7,"05/16/2024 13:37",NA,NA,NA,NA,NA,86.1,7.83,"pH reading indicates the water is suitable for irrigation",22.5,-22.7274349,30.885385,433.1,3.9,2024-05-16 13:37:00,2024-05-16,FALSE,FALSE,FALSE,FALSE,FALSE,FALSE
"Vhembe BR","Levubu River Lambani site 1","Levubu River","Lambani site 1","sunny","","Just normal sunny day",0.45,6.2,"05/20/2024 10:58",NA,NA,NA,NA,NA,124.6,7.76,"pH reading indicates the water is suitable for irrigation",21,-22.7454892,30.8844882,429.3,5,2024-05-20 10:58:00,2024-05-20,FALSE,FALSE,FALSE,FALSE,FALSE,FALSE
"Kruger 2 Canyons BR","Moetladimo Site 1","Moetladimo","Site 1","cloudy","","",NA,224.3,"05/21/2024 08:29",NA,NA,NA,NA,NA,50.4,7.89,"pH reading indicates the water is suitable for irrigation",21.2,-24.2587367,30.4538933,617.000061,4.8,2024-05-21 08:29:00,2024-05-21,FALSE,FALSE,TRUE,FALSE,FALSE,TRUE
"Kruger 2 Canyons BR","Moetladimo Moe Alt 2","Moetladimo","Moe Alt 2","cloudy","","",NA,187,"05/21/2024 09:24",NA,NA,NA,NA,NA,56.7,8.27,"pH reading indicates the water is suitable for irrigation",20.9,-24.25154,30.4518583,604.1000366,4.9,2024-05-21 09:24:00,2024-05-21,FALSE,FALSE,FALSE,FALSE,FALSE,FALSE
"Kruger 2 Canyons BR","Moetladimo Moe Alt 2","Moetladimo","Moe Alt 2","cloudy","","",NA,175.7,"05/21/2024 09:48",NA,NA,NA,NA,NA,63.8,8.12,"pH reading indicates the water is suitable for irrigation",21.3,-24.247255,30.4552917,609.3,4.4,2024-05-21 09:48:00,2024-05-21,FALSE,FALSE,FALSE,FALSE,FALSE,FALSE
"Vhembe BR","Levubu River Tshakhuma2","Levubu River","Tshakhuma2","cloudy","","",0.59,6.9,"05/21/2024 09:44",NA,NA,NA,NA,NA,99.3,7.98,"pH reading indicates the water is suitable for irrigation",20.5,-23.0529199,30.296566,669.7144775,4.013,2024-05-21 09:44:00,2024-05-21,FALSE,FALSE,FALSE,FALSE,FALSE,FALSE
"Vhembe BR","Levubu River Mulenzhe site 1","Levubu River","Mulenzhe site 1","partly_cloudy","","",1.52,17.6,"05/21/2024 10:09",NA,NA,NA,NA,NA,148.2,7.8,"pH reading indicates the water is suitable for irrigation",20.9,-22.971181,30.6038121,484.7,4.54,2024-05-21 10:09:00,2024-05-21,FALSE,FALSE,FALSE,FALSE,FALSE,FALSE
"Marico BR","Groot Marico River Mukhajadi","Groot Marico River","Mukhajadi","sunny","","Tree branches on stream",87.2,17.4,"05/22/2024 09:50",NA,NA,NA,NA,NA,26,7.9,"pH reading indicates the water is suitable for irrigation",17.4,-25.6289371,26.4103291,1142.875672,4.9,2024-05-22 09:50:00,2024-05-22,FALSE,TRUE,FALSE,FALSE,FALSE,TRUE
"Marico BR","Groot Marico River Boss Upstream","Groot Marico River","Boss Upstream","sunny","","No rain for the past few weeks",7.09,17.3,"05/22/2024 10:04",NA,NA,NA,NA,NA,250,8.01,"pH reading indicates the water is suitable for irrigation",16.7,-25.6292688,26.4103021,1148,4.7,2024-05-22 10:04:00,2024-05-22,FALSE,FALSE,FALSE,FALSE,FALSE,FALSE
"Vhembe BR","Levubu River Halambani site 1","Levubu River","Halambani site 1","sunny","","",0.15,2.1,"05/22/2024 11:19",NA,NA,NA,NA,NA,130,7.54,"pH reading indicates the water is suitable for irrigation",20.5,-22.7453653,30.8845072,416,4.86,2024-05-22 11:19:00,2024-05-22,FALSE,FALSE,FALSE,FALSE,FALSE,FALSE
"Vhembe BR","Levubu River Lambani site 1","Levubu River","Lambani site 1","sunny","","",0.15,2.1,"05/22/2024 10:11",NA,NA,NA,NA,NA,130,7.54,"pH reading indicates the water is suitable for irrigation",20.5,-22.7455155,30.8846166,382.1,4.966,2024-05-22 10:11:00,2024-05-22,FALSE,FALSE,FALSE,FALSE,FALSE,FALSE
"Vhembe BR","Levubu River Lambani site 2","Levubu River","Lambani site 2","sunny","","",0.15,2.7,"05/22/2024 10:19",NA,NA,NA,NA,NA,130,7.54,"pH reading indicates the water is suitable for irrigation",20.5,-22.7454655,30.8845337,426.4,3.9,2024-05-22 10:19:00,2024-05-22,FALSE,FALSE,FALSE,FALSE,FALSE,FALSE
"Vhembe BR","Levubu River Tshakhuma1","Levubu River","Tshakhuma1","sunny","","",1.05,12.5,"05/23/2024 09:56",NA,NA,NA,NA,NA,109.4,7.91,"pH reading indicates the water is suitable for irrigation",21.4,-23.0540727,30.2970131,663.7895508,3.79,2024-05-23 09:56:00,2024-05-23,FALSE,FALSE,FALSE,FALSE,FALSE,FALSE
"Kruger 2 Canyons BR","Olifants Site 1","Olifants","Site 1","sunny","","",NA,155.8,"05/23/2024 08:44",NA,NA,NA,NA,NA,237,8.56,"pH reading indicates the water is NOT suitable for irrigation",19.4,-24.3620117,30.65863,511.1000061,5,2024-05-23 08:44:00,2024-05-23,FALSE,FALSE,FALSE,FALSE,FALSE,FALSE
"Kruger 2 Canyons BR","Marakalala Site 1","Marakalala","Site 1","partly_cloudy","","The area is used for grazing livestock and Agriculture activities.",50,18.8,"05/23/2024 10:42",NA,NA,NA,NA,NA,230,6.99,"pH reading indicates the water is suitable for irrigation",21.5,-24.5228056,30.70726724,849.745008,4.9,2024-05-23 10:42:00,2024-05-23,FALSE,TRUE,FALSE,FALSE,FALSE,TRUE
"Kruger 2 Canyons BR","Marakalala Site 2","Marakalala","Site 2","sunny","","",62.4,19.2,"05/23/2024 11:49",NA,NA,NA,NA,NA,427,7.61,"pH reading indicates the water is suitable for irrigation",20.6,-24.52662905,30.71943829,821.4453414,4.9,2024-05-23 11:49:00,2024-05-23,FALSE,TRUE,FALSE,FALSE,FALSE,TRUE
"Marico BR","Kaaloog se Loop Komkrans","Kaaloog se Loop","Komkrans","sunny","","",8.9,12.5,"05/25/2024 14:55",NA,NA,NA,NA,NA,2.5,8.6,"pH reading indicates the water is NOT suitable for irrigation",12.4,-25.7759054,26.4386659,1352.3,5,2024-05-25 14:55:00,2024-05-25,FALSE,FALSE,FALSE,FALSE,FALSE,FALSE
"Kruger 2 Canyons BR","Moetladimo Site 1","Moetladimo","Site 1","partly_cloudy","","",NA,159.6,"05/28/2024 08:39",NA,NA,NA,NA,NA,50.2,7.81,"pH reading indicates the water is suitable for irrigation",20.4,-24.25872,30.4538567,610.9,3.9,2024-05-28 08:39:00,2024-05-28,FALSE,FALSE,FALSE,FALSE,FALSE,FALSE
"Vhembe BR","Levubu River Mulenzhe site 2","Levubu River","Mulenzhe site 2","cloudy","","",1.74,19.2,"05/28/2024 09:33",NA,NA,NA,NA,NA,155.7,7.8,"pH reading indicates the water is suitable for irrigation",20.3,-22.971691,30.6033974,476.4,4.26,2024-05-28 09:33:00,2024-05-28,FALSE,FALSE,FALSE,FALSE,FALSE,FALSE
"Vhembe BR","Tshakhuma2 Tshakhuma2","Tshakhuma2","Tshakhuma2","partly_cloudy","","",0.29,3.4,"05/28/2024 10:00",NA,NA,NA,NA,NA,92.2,8.6,"pH reading indicates the water is NOT suitable for irrigation",20,-23.0529668,30.2965295,669.6248779,4.912,2024-05-28 10:00:00,2024-05-28,FALSE,FALSE,FALSE,FALSE,FALSE,FALSE
"Kruger 2 Canyons BR","Moetladimo Moe Alt 2","Moetladimo","Moe Alt 2","partly_cloudy","","",NA,144,"05/28/2024 10:07",NA,NA,NA,NA,NA,59.1,8.74,"pH reading indicates the water is NOT suitable for irrigation",21.1,-24.2518583,30.4517767,584.1,4.2,2024-05-28 10:07:00,2024-05-28,FALSE,FALSE,FALSE,FALSE,FALSE,FALSE
"Kruger 2 Canyons BR","Olifants Site 1","Olifants","Site 1","sunny","","",NA,125,"05/30/2024 08:36",NA,NA,NA,NA,NA,513,8.21,"pH reading indicates the water is suitable for irrigation",16.5,-24.3619793,30.6586495,464.9,4.7,2024-05-30 08:36:00,2024-05-30,FALSE,FALSE,FALSE,FALSE,FALSE,FALSE
"Vhembe BR","Tshakhuma01 Tshakhuma001","Tshakhuma01","Tshakhuma001","sunny","","",0.26,3.4,"05/30/2024 10:00",NA,NA,NA,NA,NA,240,7.97,"pH reading indicates the water is suitable for irrigation",20.3,-23.0540925,30.2969917,672.8500977,6.921,2024-05-30 10:00:00,2024-05-30,FALSE,FALSE,FALSE,FALSE,FALSE,FALSE
"Vhembe BR","Levubu River Lambani site 2","Levubu River","Lambani site 2","sunny","","",0.78,9.9,"05/30/2024 10:27",NA,NA,NA,NA,NA,92.8,7.73,"pH reading indicates the water is suitable for irrigation",17.5,-22.72741,30.8853267,427.6,3.9,2024-05-30 10:27:00,2024-05-30,FALSE,FALSE,FALSE,FALSE,FALSE,FALSE
"Kruger 2 Canyons BR","Marakalala Site 3","Marakalala","Site 3","sunny","","",34.6,NA,"05/30/2024 10:29",NA,NA,NA,NA,NA,428,7.61,"pH reading indicates the water is suitable for irrigation",18.1,-24.52655615,30.71957822,836.744691,4.9,2024-05-30 10:29:00,2024-05-30,FALSE,TRUE,FALSE,FALSE,FALSE,TRUE
"Kruger 2 Canyons BR","Marakalala Site 1","Marakalala","Site 1","sunny","","",33,22.2,"05/30/2024 11:34",NA,NA,NA,NA,NA,217,6.92,"pH reading indicates the water is suitable for irrigation",22.6,-24.52282389,30.70728008,836.5151216,4.9,2024-05-30 11:34:00,2024-05-30,FALSE,TRUE,FALSE,FALSE,FALSE,TRUE
"Vhembe BR","Levubu River Mulenzhe Site 1","Levubu River","Mulenzhe Site 1","partly_cloudy","","Water flow was slow today.",1.52,17.6,"05/21/2024 09:37",NA,NA,NA,NA,NA,148.2,7.8,"pH reading indicates the water is suitable for irrigation",20.9,-22.97120819,30.60365805,508.3839111,6.906936,2024-05-21 09:37:00,2024-05-21,FALSE,FALSE,FALSE,FALSE,FALSE,FALSE
"Vhembe BR","Levubu River Mulenzhe Site 1","Levubu River","Mulenzhe Site 1","sunny","","",1.83,20.6,"05/30/2024 12:05",NA,NA,NA,NA,NA,149.2,8.01,"pH reading indicates the water is suitable for irrigation",20.4,-22.9711882,30.6037807,456.4,4.76,2024-05-30 12:05:00,2024-05-30,FALSE,FALSE,FALSE,FALSE,FALSE,FALSE
"Vhembe BR","Levubu River Mulenzhe site 1","Levubu River","Mulenzhe site 1","sunny","","Water level keep decreasing",1.83,20.6,"05/30/2024 12:05",NA,NA,NA,NA,NA,149.2,8.01,"pH reading indicates the water is suitable for irrigation",20.4,-22.97122304,30.6038085,482.4838257,4.4899774,2024-05-30 12:05:00,2024-05-30,FALSE,FALSE,FALSE,FALSE,FALSE,FALSE
"Vhembe BR","Levubu River Lambani site 02","Levubu River","Lambani site 02","sunny","","",0.78,9.9,"05/30/2024 10:27",NA,NA,NA,NA,NA,92.8,7.73,"pH reading indicates the water is suitable for irrigation",17.5,-22.7274257,30.8854046,418.4,4.6,2024-05-30 10:27:00,2024-05-30,FALSE,FALSE,FALSE,FALSE,FALSE,FALSE
"Vhembe BR","Levubu River Lambani site 2","Levubu River","Lambani site 2","sunny","","",0.78,9.9,"05/30/2024 10:27",NA,NA,NA,NA,NA,92.8,7.73,"pH reading indicates the water is suitable for irrigation",17.5,-22.7275395,30.8851272,440.3,4.95,2024-05-30 10:27:00,2024-05-30,FALSE,FALSE,FALSE,FALSE,FALSE,FALSE
"Vhembe BR","Levubu River Lambani site 2","Levubu River","Lambani site 2","sunny","","",2.51,31.4,"05/31/2024 09:07",NA,NA,NA,NA,NA,86.9,7.59,"pH reading indicates the water is suitable for irrigation",16,-22.7276152,30.8852476,411.9,4.72,2024-05-31 09:07:00,2024-05-31,FALSE,FALSE,FALSE,FALSE,FALSE,FALSE
"Vhembe BR","Levubu River Lambani site 2","Levubu River","Lambani site 2","sunny","","",2.51,31.4,"05/31/2024 09:06",NA,NA,NA,NA,NA,68.9,7.59,"pH reading indicates the water is suitable for irrigation",16,-22.727588,30.8852914,434.7,4.333,2024-05-31 09:06:00,2024-05-31,FALSE,FALSE,FALSE,FALSE,FALSE,FALSE
"Vhembe BR","Levubu River Lambani site 01","Levubu River","Lambani site 01","partly_cloudy","","",2.8,38.3,"06/03/2024 10:14",NA,NA,NA,NA,NA,107.6,7.7,"pH reading indicates the water is suitable for irrigation",19.6,-22.7454178,30.884564,347.6,4.5,2024-06-03 10:14:00,2024-06-03,FALSE,FALSE,FALSE,FALSE,FALSE,FALSE
"Vhembe BR","Levubu River Lambani site 1","Levubu River","Lambani site 1","sunny","","",2.8,38.3,"06/03/2024 10:30",NA,NA,NA,NA,NA,107.6,7.7,"pH reading indicates the water is suitable for irrigation",19.6,-22.7454853,30.884492,421.1,4.833,2024-06-03 10:30:00,2024-06-03,FALSE,FALSE,FALSE,FALSE,FALSE,FALSE
"Vhembe BR","Levubu River Mulenzhe site 2","Levubu River","Mulenzhe site 2","sunny","","",18.2,20.7,"06/04/2024 10:14",NA,NA,NA,NA,NA,149.9,8.27,"pH reading indicates the water is suitable for irrigation",19.7,-22.9717023,30.603452,490.1,4.291,2024-06-04 10:14:00,2024-06-04,FALSE,FALSE,FALSE,FALSE,FALSE,FALSE
"Kruger 2 Canyons BR","Kubjaname Site 2","Kubjaname","Site 2","sunny","","",NA,108.5,"06/05/2024 09:01",NA,NA,NA,NA,NA,233,7.55,"pH reading indicates the water is suitable for irrigation",16,-24.303565,30.5047417,594.5,4.4,2024-06-05 09:01:00,2024-06-05,FALSE,FALSE,FALSE,FALSE,FALSE,FALSE
"Kruger 2 Canyons BR","Kubjaname Site 1","Kubjaname","Site 1","sunny","","",NA,116,"06/05/2024 09:19",NA,NA,NA,NA,NA,236,7.77,"pH reading indicates the water is suitable for irrigation",14.4,-24.3044373,30.5049213,616.4,4.875,2024-06-05 09:19:00,2024-06-05,FALSE,FALSE,FALSE,FALSE,FALSE,FALSE
"Kruger 2 Canyons BR","Mohlatsengwana Site 3","Mohlatsengwana","Site 3","sunny","","",NA,NA,"06/05/2024 08:58",NA,NA,NA,NA,NA,324,8.13,"pH reading indicates the water is suitable for irrigation",14.9,-24.5406289,30.69545286,858.2304491,4.9,2024-06-05 08:58:00,2024-06-05,FALSE,FALSE,FALSE,FALSE,FALSE,FALSE
"Kruger 2 Canyons BR","Kubjaname Site 3","Kubjaname","Site 3","sunny","","",NA,118,"06/05/2024 09:56",NA,NA,NA,NA,NA,255,7.52,"pH reading indicates the water is suitable for irrigation",15.2,-24.30224,30.5052333,621.4,4.4,2024-06-05 09:56:00,2024-06-05,FALSE,FALSE,FALSE,FALSE,FALSE,FALSE
"Kruger 2 Canyons BR","Mohlatsengwana Site 2","Mohlatsengwana","Site 2","sunny","","",NA,NA,"06/05/2024 10:08",NA,NA,NA,NA,NA,324,8.19,"pH reading indicates the water is suitable for irrigation",14.9,-24.53955627,30.68933443,859.404357,4.9,2024-06-05 10:08:00,2024-06-05,FALSE,FALSE,FALSE,FALSE,FALSE,FALSE
"Kruger 2 Canyons BR","Marakalala Site 3","Marakalala","Site 3","sunny","","",6.2,16,"06/06/2024 10:14",NA,NA,NA,NA,NA,433,7.72,"pH reading indicates the water is suitable for irrigation",15.8,-24.52659242,30.71937392,832.806997,4.9,2024-06-06 10:14:00,2024-06-06,FALSE,FALSE,FALSE,FALSE,FALSE,FALSE
"Kruger 2 Canyons BR","Treur River Site 1","Treur River","Site 1","sunny","","",10.9,NA,"06/06/2024 10:31",NA,NA,NA,NA,NA,47,7.56,"pH reading indicates the water is suitable for irrigation",16,-24.6752639,30.8116241,1123.1,4.55,2024-06-06 10:31:00,2024-06-06,FALSE,FALSE,FALSE,FALSE,FALSE,FALSE
"Kruger 2 Canyons BR","Marakalala Site 1","Marakalala","Site 1","sunny","","",11,19,"06/06/2024 11:36",NA,NA,NA,NA,NA,240,6.99,"pH reading indicates the water is suitable for irrigation",18.6,-24.52289971,30.70725543,858.0519152,4.9,2024-06-06 11:36:00,2024-06-06,FALSE,FALSE,FALSE,FALSE,FALSE,FALSE
"Kruger 2 Canyons BR","Marakalala Site 1","Marakalala","Site 1","sunny","","",11,17.6,"06/06/2024 11:40",NA,NA,NA,NA,NA,240,6.99,"pH reading indicates the water is suitable for irrigation",18,-24.52289971,30.70725543,858.0519152,4.9,2024-06-06 11:40:00,2024-06-06,FALSE,FALSE,FALSE,FALSE,FALSE,FALSE
"Kruger 2 Canyons BR","Klaserie Site 1","Klaserie","Site 1","light_rain","","",6.78,NA,"06/03/2024 09:17",NA,NA,NA,NA,NA,61.5,8.76,"pH reading indicates the water is NOT suitable for irrigation",16,-24.6059787,30.9703456,662.9,4.36,2024-06-03 09:17:00,2024-06-03,FALSE,FALSE,FALSE,FALSE,FALSE,FALSE
"Kruger 2 Canyons BR","Klaserie Site 2","Klaserie","Site 2","light_rain","","",7.35,NA,"06/03/2024 09:44",NA,NA,NA,NA,NA,61,8.45,"pH reading indicates the water is suitable for irrigation",16.6,-24.604459,30.9729729,658.6,4.18,2024-06-03 09:44:00,2024-06-03,FALSE,FALSE,FALSE,FALSE,FALSE,FALSE
"Kruger 2 Canyons BR","Klaserie Site 3","Klaserie","Site 3","cloudy","","",7.63,NA,"06/03/2024 10:19",NA,NA,NA,NA,NA,59.9,8.34,"pH reading indicates the water is suitable for irrigation",16.7,-24.6044687,30.9753183,666.3,2.883,2024-06-03 10:19:00,2024-06-03,FALSE,FALSE,FALSE,FALSE,FALSE,FALSE
"Kruger 2 Canyons BR","Klaserie Site 3","Klaserie","Site 3","sunny","","",8.9,12.3,"06/10/2024 10:29",NA,NA,NA,NA,NA,62,0,"pH reading indicates the water is NOT suitable for irrigation",13.4,-24.604428,30.9753813,672.8,2.94,2024-06-10 10:29:00,2024-06-10,TRUE,FALSE,FALSE,FALSE,FALSE,TRUE
"Kruger 2 Canyons BR","Klaserie Site 3","Klaserie","Site 3","sunny","","We found community members doing laundry at this area",NA,NA,"06/10/2024 12:35",NA,NA,NA,NA,NA,59,NA,"pH reading indicates the water is NOT suitable for irrigation",17.3,-24.6045158,30.9754459,556,4.347,2024-06-10 12:35:00,2024-06-10,FALSE,FALSE,FALSE,FALSE,FALSE,FALSE
"Kruger 2 Canyons BR","Klaserie Site 3","Klaserie","Site 3","partly_cloudy","","",0,0,"06/10/2024 12:37",NA,NA,NA,NA,NA,66.7,0,"pH reading indicates the water is NOT suitable for irrigation",15.4,-24.6044384,30.9754565,674.1,4.64,2024-06-10 12:37:00,2024-06-10,TRUE,FALSE,FALSE,FALSE,FALSE,TRUE
"Vhembe BR","Levubu River Lambani site 2","Levubu River","Lambani site 2","partly_cloudy","","",3.27,42.7,"06/10/2024 13:26",NA,NA,NA,NA,NA,106.1,7.83,"pH reading indicates the water is suitable for irrigation",17.7,-22.7276138,30.8852226,400.4,4.1,2024-06-10 13:26:00,2024-06-10,FALSE,FALSE,FALSE,FALSE,FALSE,FALSE
"Vhembe BR","Levubu River Lambani site 2","Levubu River","Lambani site 2","partly_cloudy","","",3.27,42.7,"06/10/2024 13:20",NA,NA,NA,NA,NA,103.1,7.83,"pH reading indicates the water is suitable for irrigation",17.7,-22.7274984,30.8853102,426.2,4.825,2024-06-10 13:20:00,2024-06-10,FALSE,FALSE,FALSE,FALSE,FALSE,FALSE
"Vhembe BR","Levubu River Lambani site 01","Levubu River","Lambani site 01","sunny","","",2.8,38.3,"06/03/2024 11:14",NA,NA,NA,NA,NA,107.6,7.7,"pH reading indicates the water is suitable for irrigation",19.6,-22.7454207,30.8842329,412.4,4.75,2024-06-03 11:14:00,2024-06-03,FALSE,FALSE,FALSE,FALSE,FALSE,FALSE
"Vhembe BR","Levubu River Lambani site 2","Levubu River","Lambani site 2","partly_cloudy","","",43.27,42.7,"06/10/2024 13:29",NA,NA,NA,NA,NA,103.1,7.83,"pH reading indicates the water is suitable for irrigation",71.7,-22.7275047,30.8853186,429.2,4.933,2024-06-10 13:29:00,2024-06-10,FALSE,TRUE,FALSE,FALSE,TRUE,TRUE
"Kruger 2 Canyons BR","Moetladimo Moe001 US","Moetladimo","Moe001 US","sunny","","",NA,111.7,"06/11/2024 08:17",NA,NA,NA,NA,NA,122.7,7.58,"pH reading indicates the water is suitable for irrigation",14.8,-24.2663246,30.4492869,592.3,4.6,2024-06-11 08:17:00,2024-06-11,FALSE,FALSE,FALSE,FALSE,FALSE,FALSE
"Kruger 2 Canyons BR","Moetladimo Site 1","Moetladimo","Site 1","sunny","","",NA,101.7,"06/11/2024 09:37",NA,NA,NA,NA,NA,109.9,7.96,"pH reading indicates the water is suitable for irrigation",17.1,-24.2588117,30.4539167,616.9000244,4.6,2024-06-11 09:37:00,2024-06-11,FALSE,FALSE,FALSE,FALSE,FALSE,FALSE
"Vhembe BR","Levubu River Mulenzhe site 1","Levubu River","Mulenzhe site 1","partly_cloudy","","",1.43,17.4,"06/11/2024 10:13",NA,NA,NA,NA,NA,151.8,8.08,"pH reading indicates the water is suitable for irrigation",18.3,-22.97120831,30.60379049,527.2793904,4.9,2024-06-11 10:13:00,2024-06-11,FALSE,FALSE,FALSE,FALSE,FALSE,FALSE
"Vhembe BR","Levubu River Mulenzhe site 1","Levubu River","Mulenzhe site 1","partly_cloudy","","",1.43,17.4,"06/11/2024 10:13",NA,NA,NA,NA,NA,151.8,8.08,"pH reading indicates the water is suitable for irrigation",18.3,-22.9711515,30.603824,489.9,3.8,2024-06-11 10:13:00,2024-06-11,FALSE,FALSE,FALSE,FALSE,FALSE,FALSE
"Kruger 2 Canyons BR","Moetladimo Moe Alt 2","Moetladimo","Moe Alt 2","sunny","","",NA,92.4,"06/11/2024 10:13",NA,NA,NA,NA,NA,149.7,8.34,"pH reading indicates the water is suitable for irrigation",15.7,-24.2518442,30.4517079,582.7,3.9,2024-06-11 10:13:00,2024-06-11,FALSE,FALSE,FALSE,FALSE,FALSE,FALSE
"Vhembe BR","Levubu River Tshakhuma1","Levubu River","Tshakhuma1","sunny","","",7.67,7.5,"06/12/2024 10:25",NA,NA,NA,NA,NA,271,7.75,"pH reading indicates the water is suitable for irrigation",19,-23.0541793,30.2969597,660.3776855,4.336,2024-06-12 10:25:00,2024-06-12,FALSE,FALSE,FALSE,FALSE,FALSE,FALSE
"Kruger 2 Canyons BR","Kubjaname Site 1","Kubjaname","Site 1","sunny","","",NA,98,"06/12/2024 09:51",NA,NA,NA,NA,NA,253,7.82,"pH reading indicates the water is suitable for irrigation",15.7,-24.3043814,30.5049473,624.1,4.75,2024-06-12 09:51:00,2024-06-12,FALSE,FALSE,FALSE,FALSE,FALSE,FALSE
"Kruger 2 Canyons BR","Kubjaname Site 3","Kubjaname","Site 3","sunny","","",NA,101.7,"06/12/2024 10:30",NA,NA,NA,NA,NA,266,7.66,"pH reading indicates the water is suitable for irrigation",16.6,-24.30227,30.5052417,613.9,3.9,2024-06-12 10:30:00,2024-06-12,FALSE,FALSE,FALSE,FALSE,FALSE,FALSE
"Kruger 2 Canyons BR","Kubjaname Kub001 US","Kubjaname","Kub001 US","sunny","","",NA,101.7,"06/12/2024 07:56",NA,NA,NA,NA,NA,107.9,7.35,"pH reading indicates the water is suitable for irrigation",14.9,-24.3229007,30.4862019,721.8,4.5,2024-06-12 07:56:00,2024-06-12,FALSE,FALSE,FALSE,FALSE,FALSE,FALSE
"Vhembe BR","Lambani site 2 Lambani site 2","Lambani site 2","Lambani site 2","partly_cloudy","","",3.36,43.3,"06/12/2024 12:36",NA,NA,NA,NA,NA,92.1,7.4,"pH reading indicates the water is suitable for irrigation",71.2,-22.7276611,30.8852506,402.6,4.88,2024-06-12 12:36:00,2024-06-12,FALSE,FALSE,FALSE,FALSE,TRUE,TRUE
"Vhembe BR","Levubu River Lambani site 2","Levubu River","Lambani site 2","sunny","","",3.36,43.3,"06/12/2024 13:52",NA,NA,NA,NA,NA,92.1,7.4,"pH reading indicates the water is suitable for irrigation",17.2,-22.727657,30.8853416,436,3.287,2024-06-12 13:52:00,2024-06-12,FALSE,FALSE,FALSE,FALSE,FALSE,FALSE
"Kruger 2 Canyons BR","Olifants Oli001 US","Olifants","Oli001 US","other","Windy","",NA,169.44,"06/13/2024 08:59",NA,NA,NA,NA,NA,521,8.76,"pH reading indicates the water is NOT suitable for irrigation",13.9,-24.4240249,30.555725,532.8,4.8,2024-06-13 08:59:00,2024-06-13,FALSE,FALSE,FALSE,FALSE,FALSE,FALSE
"Kruger 2 Canyons BR","Mohlatsengwana Site 3","Mohlatsengwana","Site 3","sunny","","",NA,NA,"06/13/2024 09:20",NA,NA,NA,NA,NA,376,8.23,"pH reading indicates the water is suitable for irrigation",13.3,-24.5406801,30.6954704,857.5,3.314,2024-06-13 09:20:00,2024-06-13,FALSE,FALSE,FALSE,FALSE,FALSE,FALSE
"Vhembe BR","Levubu River Mulenzhe site 2","Levubu River","Mulenzhe site 2","sunny","","",1.53,15.4,"06/13/2024 09:57",NA,NA,NA,NA,NA,153.6,8.07,"pH reading indicates the water is suitable for irrigation",17.4,-22.97206782,30.60327495,482.2372686,4.7,2024-06-13 09:57:00,2024-06-13,FALSE,FALSE,FALSE,FALSE,FALSE,FALSE
"Vhembe BR","Levubu River Mulenzhe site 2","Levubu River","Mulenzhe site 2","sunny","","",1.53,15.4,"06/13/2024 09:57",NA,NA,NA,NA,NA,153.6,8.07,"pH reading indicates the water is suitable for irrigation",17.4,-22.9716942,30.6033996,485,4.98,2024-06-13 09:57:00,2024-06-13,FALSE,FALSE,FALSE,FALSE,FALSE,FALSE
"Vhembe BR","Levubu River Tshakhuma2","Levubu River","Tshakhuma2","sunny","","",7.51,77.1,"06/13/2024 09:53",NA,NA,NA,NA,NA,317,7.74,"pH reading indicates the water is suitable for irrigation",23.8,-23.0529676,30.2964807,687.2,3.9,2024-06-13 09:53:00,2024-06-13,FALSE,FALSE,FALSE,FALSE,FALSE,FALSE
"Kruger 2 Canyons BR","Mohlatsengwana Site 2","Mohlatsengwana","Site 2","sunny","","",NA,NA,"06/13/2024 10:00",NA,NA,NA,NA,NA,377,8.22,"pH reading indicates the water is suitable for irrigation",11.5,-24.5395955,30.6893045,855.5,4.88,2024-06-13 10:00:00,2024-06-13,FALSE,FALSE,FALSE,FALSE,FALSE,FALSE
"Kruger 2 Canyons BR","Olifants Site 1","Olifants","Site 1","sunny","","",NA,125.87,"06/13/2024 10:06",NA,NA,NA,NA,NA,515,8.65,"pH reading indicates the water is NOT suitable for irrigation",16.9,-24.3620176,30.6586702,477.7,4.775,2024-06-13 10:06:00,2024-06-13,FALSE,FALSE,FALSE,FALSE,FALSE,FALSE
"Kruger 2 Canyons BR","Mohlatsengwana Site 1","Mohlatsengwana","Site 1","sunny","","",NA,NA,"06/13/2024 11:16",NA,NA,NA,NA,NA,370,8.11,"pH reading indicates the water is suitable for irrigation",12.5,-24.55188,30.6754118,863.8,4.35,2024-06-13 11:16:00,2024-06-13,FALSE,FALSE,FALSE,FALSE,FALSE,FALSE
"Vhembe BR","Lambani site 2 No site name given","Lambani site 2","No site name given","partly_cloudy","","",3.36,43.3,"06/12/2024 12:39",NA,NA,NA,NA,NA,92.1,7.4,"pH reading indicates the water is suitable for irrigation",17.2,-22.7276296,30.8853015,421.8,4.75,2024-06-12 12:39:00,2024-06-12,FALSE,FALSE,FALSE,FALSE,FALSE,FALSE
"Vhembe BR","Tshakhuma01 Tshakhuma001","Tshakhuma01","Tshakhuma001","sunny","","",7.46,76.6,"06/18/2024 10:14",NA,NA,NA,NA,NA,178.8,8,"pH reading indicates the water is suitable for irrigation",21,-23.0541251,30.2969232,668.9,4.4,2024-06-18 10:14:00,2024-06-18,FALSE,FALSE,FALSE,FALSE,FALSE,FALSE
"Vhembe BR","Levubu River Mulenzhe Site 1","Levubu River","Mulenzhe Site 1","sunny","","",1.72,17.1,"06/18/2024 10:26",NA,NA,NA,NA,NA,154.2,7.97,"pH reading indicates the water is suitable for irrigation",17.5,-22.97113253,30.6038126,496.7783194,4.9,2024-06-18 10:26:00,2024-06-18,FALSE,FALSE,FALSE,FALSE,FALSE,FALSE
"Vhembe BR","Levubu River Mulenzhe Site 1","Levubu River","Mulenzhe Site 1","sunny","","",1.72,17.1,"06/18/2024 10:24",NA,NA,NA,NA,NA,154.2,7.97,"pH reading indicates the water is suitable for irrigation",17.5,-22.9711823,30.6036635,472,4.64,2024-06-18 10:24:00,2024-06-18,FALSE,FALSE,FALSE,FALSE,FALSE,FALSE
"Kruger 2 Canyons BR","Marakalala Site 3","Marakalala","Site 3","sunny","","",17.2,NA,"06/19/2024 10:27",NA,NA,NA,NA,NA,472,7.79,"pH reading indicates the water is suitable for irrigation",16,-24.52659371,30.71939684,842.7911885,4.9,2024-06-19 10:27:00,2024-06-19,FALSE,FALSE,FALSE,FALSE,FALSE,FALSE
"Vhembe BR","Levubu River Lambani site 1","Levubu River","Lambani site 1","sunny","","",3.21,42.2,"06/19/2024 10:57",NA,NA,NA,NA,NA,135.7,7.8,"pH reading indicates the water is suitable for irrigation",17,-22.7455891,30.8844639,396.8,4.9,2024-06-19 10:57:00,2024-06-19,FALSE,FALSE,FALSE,FALSE,FALSE,FALSE
"Kruger 2 Canyons BR","Kubjaname Kub001 US","Kubjaname","Kub001 US","sunny","","",NA,114.01,"06/19/2024 17:32",NA,NA,NA,NA,NA,104.1,7.45,"pH reading indicates the water is suitable for irrigation",16.6,-24.3228815,30.4854572,654.6,4.966,2024-06-19 17:32:00,2024-06-19,FALSE,FALSE,FALSE,FALSE,FALSE,FALSE
"Vhembe BR","Levubu River Halambani site 1","Levubu River","Halambani site 1","sunny","","",3.21,42.2,"06/19/2024 10:28",NA,NA,NA,NA,NA,135.7,7.8,"pH reading indicates the water is suitable for irrigation",17,-22.7454225,30.8844798,434.1,4.85,2024-06-19 10:28:00,2024-06-19,FALSE,FALSE,FALSE,FALSE,FALSE,FALSE
"Vhembe BR","Levubu River Mulenzhe site 2","Levubu River","Mulenzhe site 2","cloudy","","",1.38,14.4,"06/20/2024 09:32",NA,NA,NA,NA,NA,155.6,8.06,"pH reading indicates the water is suitable for irrigation",17.5,-22.97172638,30.60347021,480.328059,4.9,2024-06-20 09:32:00,2024-06-20,FALSE,FALSE,FALSE,FALSE,FALSE,FALSE
"Vhembe BR","Levubu River Mulenzhe site 2","Levubu River","Mulenzhe site 2","cloudy","","",1.38,14.4,"06/20/2024 09:32",NA,NA,NA,NA,NA,155.6,8.06,"pH reading indicates the water is suitable for irrigation",17.5,-22.9717605,30.6034552,500.9,4.75,2024-06-20 09:32:00,2024-06-20,FALSE,FALSE,FALSE,FALSE,FALSE,FALSE
"Vhembe BR","Levubu River Tshakhuma2","Levubu River","Tshakhuma2","cloudy","","",8.27,82.9,"06/20/2024 10:03",NA,NA,NA,NA,NA,163.5,8.19,"pH reading indicates the water is suitable for irrigation",18,-23.0528794,30.2965438,634.5,4.071,2024-06-20 10:03:00,2024-06-20,FALSE,FALSE,FALSE,FALSE,FALSE,FALSE
"Marico BR","Kuilfontein No site name given","Kuilfontein","No site name given","sunny","","",66.7,11.2,"06/20/2024 11:58",NA,NA,NA,NA,NA,320,7.45,"pH reading indicates the water is suitable for irrigation",11.6,-25.7444778,26.352064,1403.721134,4.9,2024-06-20 11:58:00,2024-06-20,FALSE,TRUE,FALSE,FALSE,FALSE,TRUE
"Marico BR","Doorinkloof spruit No site name given","Doorinkloof spruit","No site name given","sunny","","",8.6,12.5,"06/20/2024 10:27",NA,NA,NA,NA,NA,409,7.55,"pH reading indicates the water is suitable for irrigation",13.7,-25.7408851,26.3480359,1381.399406,4.9,2024-06-20 10:27:00,2024-06-20,FALSE,FALSE,FALSE,FALSE,FALSE,FALSE
"Marico BR","Doorkloof Spruit Doornkloof Spruit","Doorkloof Spruit","Doornkloof Spruit","sunny","","It is sunny and the weather is ok",5.16,55.1,"06/20/2024 10:23",NA,NA,NA,NA,NA,66.3,8.02,"pH reading indicates the water is suitable for irrigation",13.7,-25.7417117,26.3451027,1380.5,4,2024-06-20 10:23:00,2024-06-20,FALSE,FALSE,FALSE,FALSE,FALSE,FALSE
"Marico BR","Kuilfontein se loop Kuilfontein se loop","Kuilfontein se loop","Kuilfontein se loop","sunny","","",4.68,56.9,"06/20/2024 10:26",NA,NA,NA,NA,NA,308,8.09,"pH reading indicates the water is suitable for irrigation",18.1,-25.7444085,26.3521563,1388.3,5,2024-06-20 10:26:00,2024-06-20,FALSE,FALSE,FALSE,FALSE,FALSE,FALSE
"Marico BR","Doorenkloof spreit Doorenkloof spreit","Doorenkloof spreit","Doorenkloof spreit","sunny","","",339,316,"06/20/2024 10:28",NA,NA,NA,NA,NA,548,842,"pH reading indicates the water is NOT suitable for irrigation",218,-25.7418067,26.3452366,1390,4.7,2024-06-20 10:28:00,2024-06-20,TRUE,TRUE,TRUE,FALSE,TRUE,TRUE
"Marico BR","Doorenkloof spreit 1","Doorenkloof spreit","1","sunny","","",502,238,"06/20/2024 10:24",NA,NA,NA,NA,NA,369,757,"pH reading indicates the water is NOT suitable for irrigation",157,-25.7409358,26.3481052,1391.5,4.95,2024-06-20 10:24:00,2024-06-20,TRUE,TRUE,TRUE,FALSE,TRUE,TRUE
"Kruger 2 Canyons BR","Mohlatsengwana Site 3","Mohlatsengwana","Site 3","sunny","","",NA,NA,"06/20/2024 09:02",NA,NA,NA,NA,NA,370,3.3,"pH reading indicates the water is NOT suitable for irrigation",16.1,-24.54059738,30.69538509,848.8848956,4.9,2024-06-20 09:02:00,2024-06-20,TRUE,FALSE,FALSE,FALSE,FALSE,TRUE
"Kruger 2 Canyons BR","Mohlatsengwana Site 2","Mohlatsengwana","Site 2","sunny","","",NA,NA,"06/20/2024 10:00",NA,NA,NA,NA,NA,381,8.04,"pH reading indicates the water is suitable for irrigation",11,-24.53976816,30.68916539,854.4514339,4.9,2024-06-20 10:00:00,2024-06-20,FALSE,FALSE,FALSE,FALSE,FALSE,FALSE
"Kruger 2 Canyons BR","Mohlatsengwana Site 1","Mohlatsengwana","Site 1","sunny","","",NA,NA,"06/20/2024 11:33",NA,NA,NA,NA,NA,376,7.96,"pH reading indicates the water is suitable for irrigation",16.3,-24.55181951,30.67542383,867.1169713,4.9,2024-06-20 11:33:00,2024-06-20,FALSE,FALSE,FALSE,FALSE,FALSE,FALSE
"Kruger 2 Canyons BR","Moetladimo Moe001 US","Moetladimo","Moe001 US","partly_cloudy","","",NA,97.31,"06/25/2024 08:53",NA,NA,NA,NA,NA,126.5,7.75,"pH reading indicates the water is suitable for irrigation",16.7,-24.2664269,30.449365,633,3.9,2024-06-25 08:53:00,2024-06-25,FALSE,FALSE,FALSE,FALSE,FALSE,FALSE
"Kruger 2 Canyons BR","Kubjaname Kub001 US","Kubjaname","Kub001 US","sunny","","",NA,93.68,"06/26/2024 09:21",NA,NA,NA,NA,NA,111.3,7.6,"pH reading indicates the water is suitable for irrigation",16.9,-24.3227846,30.4858752,704.5,4.75,2024-06-26 09:21:00,2024-06-26,FALSE,FALSE,FALSE,FALSE,FALSE,FALSE
"Kruger 2 Canyons BR","Kubjaname Site 3","Kubjaname","Site 3","sunny","","",NA,75.04,"06/26/2024 10:15",NA,NA,NA,NA,NA,305,7.5,"pH reading indicates the water is suitable for irrigation",17.7,-24.302264,30.5052444,608.5,3.9,2024-06-26 10:15:00,2024-06-26,FALSE,FALSE,FALSE,FALSE,FALSE,FALSE
"Kruger 2 Canyons BR","Marakalala Site 3","Marakalala","Site 3","partly_cloudy","","",75.4,18.4,"06/26/2024 11:32",NA,NA,NA,NA,NA,325,769,"pH reading indicates the water is NOT suitable for irrigation",18.7,-24.52652148,30.71959464,841.1213727,4.9,2024-06-26 11:32:00,2024-06-26,TRUE,TRUE,FALSE,FALSE,FALSE,TRUE
"Kruger 2 Canyons BR","Marakalala Site 1","Marakalala","Site 1","partly_cloudy","","",30,17.7,"06/26/2024 11:34",NA,NA,NA,NA,NA,255,6.87,"pH reading indicates the water is suitable for irrigation",17.2,-24.52284889,30.70720231,853.6023594,4.7,2024-06-26 11:34:00,2024-06-26,FALSE,TRUE,FALSE,FALSE,FALSE,TRUE
"Kruger 2 Canyons BR","Olifants Oli001 US","Olifants","Oli001 US","cloudy","","",NA,99.25,"06/27/2024 08:26",NA,NA,NA,NA,NA,534,8.65,"pH reading indicates the water is NOT suitable for irrigation",16.9,-24.4240337,30.5557131,531.9,4.733,2024-06-27 08:26:00,2024-06-27,FALSE,FALSE,FALSE,FALSE,FALSE,FALSE
"Vhembe BR","Levubu River Mulenzhe site 2","Levubu River","Mulenzhe site 2","cloudy","","",1.14,11.8,"06/27/2024 09:29",NA,NA,NA,NA,NA,154.9,8.18,"pH reading indicates the water is suitable for irrigation",17.7,-22.97168538,30.60344524,483.6082858,4.9,2024-06-27 09:29:00,2024-06-27,FALSE,FALSE,FALSE,FALSE,FALSE,FALSE
"Vhembe BR","Levubu River Mulenzhe site 2","Levubu River","Mulenzhe site 2","cloudy","","",1.14,11.8,"06/27/2024 09:29",NA,NA,NA,NA,NA,154.9,8.18,"pH reading indicates the water is suitable for irrigation",17.7,-22.9717147,30.6035221,496.5,4.34,2024-06-27 09:29:00,2024-06-27,FALSE,FALSE,FALSE,FALSE,FALSE,FALSE
"Kruger 2 Canyons BR","Olifants Site 1","Olifants","Site 1","light_rain","","",NA,105.66,"06/27/2024 09:24",NA,NA,NA,NA,NA,537,8.56,"pH reading indicates the water is NOT suitable for irrigation",16.3,-24.3619433,30.6586633,491.3,4.9,2024-06-27 09:24:00,2024-06-27,FALSE,FALSE,FALSE,FALSE,FALSE,FALSE
"Vhembe BR","Levubu River Tshakhuma1","Levubu River","Tshakhuma1","partly_cloudy","","It's extremely cold weather",7.99,66.1,"06/27/2024 09:39",NA,NA,NA,NA,NA,96.4,8.07,"pH reading indicates the water is suitable for irrigation",18.1,-23.0541091,30.2968558,647.8,4.942,2024-06-27 09:39:00,2024-06-27,FALSE,FALSE,FALSE,FALSE,FALSE,FALSE
"Kruger 2 Canyons BR","Mohlatsengwana Site 3","Mohlatsengwana","Site 3","cloudy","","",69.5,NA,"06/27/2024 09:08",NA,NA,NA,NA,NA,458,8.21,"pH reading indicates the water is suitable for irrigation",NA,-24.54062696,30.69549605,851.8225137,4.9,2024-06-27 09:08:00,2024-06-27,FALSE,TRUE,FALSE,FALSE,FALSE,TRUE
"Kruger 2 Canyons BR","Mohlatsengwana Site 2","Mohlatsengwana","Site 2","cloudy","","",81.3,NA,"06/27/2024 10:18",NA,NA,NA,NA,NA,81.3,8.05,"pH reading indicates the water is suitable for irrigation",16.1,-24.53960641,30.6893559,862.2677546,4.9,2024-06-27 10:18:00,2024-06-27,FALSE,TRUE,FALSE,FALSE,FALSE,TRUE
"Vhembe BR","Levubu River Tshakhuma2","Levubu River","Tshakhuma2","partly_cloudy","","",5.86,81.1,"06/28/2024 09:49",NA,NA,NA,NA,NA,117.1,7.79,"pH reading indicates the water is suitable for irrigation",20.1,-23.0528768,30.296427,672,4.671,2024-06-28 09:49:00,2024-06-28,FALSE,FALSE,FALSE,FALSE,FALSE,FALSE
"Vhembe BR","Levubu River Lambani site 2","Levubu River","Lambani site 2","partly_cloudy","","",3.28,32.5,"06/28/2024 10:34",NA,NA,NA,NA,NA,175.5,7.86,"pH reading indicates the water is suitable for irrigation",18.2,-22.7276075,30.8853203,429.2,3.9,2024-06-28 10:34:00,2024-06-28,FALSE,FALSE,FALSE,FALSE,FALSE,FALSE
"Vhembe BR","Levubu River Ha lambani site 2","Levubu River","Ha lambani site 2","partly_cloudy","","",3.28,32.5,"06/28/2024 10:32",NA,NA,NA,NA,NA,175.5,7.86,"pH reading indicates the water is suitable for irrigation",18.2,-22.7276581,30.8853233,398,4.8,2024-06-28 10:32:00,2024-06-28,FALSE,FALSE,FALSE,FALSE,FALSE,FALSE
"Vhembe BR","Levubu River Halambani site 1","Levubu River","Halambani site 1","sunny","","",3.34,43.2,"06/21/2024 10:41",NA,NA,NA,NA,NA,128.6,7.91,"pH reading indicates the water is suitable for irrigation",18,-22.7454542,30.8845507,425.5,4.066,2024-06-21 10:41:00,2024-06-21,FALSE,FALSE,FALSE,FALSE,FALSE,FALSE
"Vhembe BR","Levubu River Lambani site 02","Levubu River","Lambani site 02","cloudy","","",2.39,31.7,"06/24/2024 09:48",NA,NA,NA,NA,NA,171.7,8.28,"pH reading indicates the water is suitable for irrigation",17,-22.7275679,30.8853329,425.6,4.933,2024-06-24 09:48:00,2024-06-24,FALSE,FALSE,FALSE,FALSE,FALSE,FALSE
"Vhembe BR","Lambani site 2 Lambani site 2","Lambani site 2","Lambani site 2","partly_cloudy","","",3.28,32.5,"06/28/2024 10:15",NA,NA,NA,NA,NA,175.5,NA,"pH reading indicates the water is NOT suitable for irrigation",18.2,-22.7275581,30.8853272,428,4.975,2024-06-28 10:15:00,2024-06-28,FALSE,FALSE,FALSE,FALSE,FALSE,FALSE
"Kruger 2 Canyons BR","Klaserie Site 1","Klaserie","Site 1","sunny","","",NA,157.34,"07/01/2024 09:11",NA,NA,NA,NA,NA,58.4,NA,"pH reading indicates the water is NOT suitable for irrigation",13,-24.6059722,30.9702998,665.9,4.66,2024-07-01 09:11:00,2024-07-01,FALSE,FALSE,FALSE,FALSE,FALSE,FALSE
"Kruger 2 Canyons BR","Klaserie Site 2","Klaserie","Site 2","sunny","","",12.34,NA,"07/01/2024 09:53",NA,NA,NA,NA,NA,43.6,NA,"pH reading indicates the water is NOT suitable for irrigation",13.4,-24.6045291,30.9730052,669.8,3.757,2024-07-01 09:53:00,2024-07-01,FALSE,FALSE,FALSE,FALSE,FALSE,FALSE
"Kruger 2 Canyons BR","Klaserie Site 3","Klaserie","Site 3","sunny","","",12.06,NA,"07/01/2024 10:15",NA,NA,NA,NA,NA,40.8,NA,"pH reading indicates the water is NOT suitable for irrigation",13.5,-24.604392,30.9752833,682,4.55,2024-07-01 10:15:00,2024-07-01,FALSE,FALSE,FALSE,FALSE,FALSE,FALSE
"Vhembe BR","Levubu River Tshakhuma1","Levubu River","Tshakhuma1","sunny","","",7.81,77.8,"07/02/2024 09:28",NA,NA,NA,NA,NA,308,7.71,"pH reading indicates the water is suitable for irrigation",21.4,-23.0541489,30.2969372,666.0180664,3.9,2024-07-02 09:28:00,2024-07-02,FALSE,FALSE,FALSE,FALSE,FALSE,FALSE
"Vhembe BR","Levubu River Mulenzhe site 1","Levubu River","Mulenzhe site 1","heavy_rain","","",1.36,15.6,"07/02/2024 10:13",NA,NA,NA,NA,NA,153.2,8.26,"pH reading indicates the water is suitable for irrigation",17.2,-22.97120689,30.60377169,491.0194677,4.7,2024-07-02 10:13:00,2024-07-02,FALSE,FALSE,FALSE,FALSE,FALSE,FALSE
"Vhembe BR","Levubu River Mulenzhe Site 1","Levubu River","Mulenzhe Site 1","sunny","","",1.36,15.6,"07/02/2024 10:13",NA,NA,NA,NA,NA,153.2,8.26,"pH reading indicates the water is suitable for irrigation",17.2,-22.9712008,30.6037321,507.5,4.42,2024-07-02 10:13:00,2024-07-02,FALSE,FALSE,FALSE,FALSE,FALSE,FALSE
"Vhembe BR","Levubu River Halambani site 1","Levubu River","Halambani site 1","sunny","","",NA,NA,"07/02/2024 09:41",NA,NA,NA,NA,NA,219,7.57,"pH reading indicates the water is suitable for irrigation",19.2,-22.7454245,30.8844782,416,4.875,2024-07-02 09:41:00,2024-07-02,FALSE,FALSE,FALSE,FALSE,FALSE,FALSE
"Vhembe BR","Levubu River Lambani site 1","Levubu River","Lambani site 1","sunny","","",NA,NA,"07/02/2024 09:40",NA,NA,NA,NA,NA,219,7.57,"pH reading indicates the water is suitable for irrigation",19.2,-22.7454484,30.8845029,420.6,4.416,2024-07-02 09:40:00,2024-07-02,FALSE,FALSE,FALSE,FALSE,FALSE,FALSE
"Vhembe BR","Mulenzhe Site 1 Mulenzhe Site 1","Mulenzhe Site 1","Mulenzhe Site 1","sunny","","Activities that was being done was washing of clothes.",1.36,15.6,"07/02/2024 10:13",NA,NA,NA,NA,NA,153.2,8.26,"pH reading indicates the water is suitable for irrigation",17.2,-22.97111872,30.60382999,498.9439697,4.6980333,2024-07-02 10:13:00,2024-07-02,FALSE,FALSE,FALSE,FALSE,FALSE,FALSE
"Vhembe BR","Levubu River Lambani site 1","Levubu River","Lambani site 1","heavy_rain","","",NA,NA,"07/02/2024 09:41",NA,NA,NA,NA,NA,219,7.57,"pH reading indicates the water is suitable for irrigation",19.2,-22.7454182,30.8844631,419.1,3.9,2024-07-02 09:41:00,2024-07-02,FALSE,FALSE,FALSE,FALSE,FALSE,FALSE
"Kruger 2 Canyons BR","Moetladimo Site 1","Moetladimo","Site 1","sunny","","",NA,95.01,"07/02/2024 21:20",NA,NA,NA,NA,NA,111.5,7.95,"pH reading indicates the water is suitable for irrigation",18.4,-24.2587059,30.4538431,616.9000244,5.818,2024-07-02 21:20:00,2024-07-02,FALSE,FALSE,FALSE,FALSE,FALSE,FALSE
"Kruger 2 Canyons BR","Moetladimo Moe001 US","Moetladimo","Moe001 US","sunny","","",NA,87.14,"07/02/2024 21:21",NA,NA,NA,NA,NA,123.7,7.79,"pH reading indicates the water is suitable for irrigation",16.4,-24.2663101,30.4492799,602.8,3.9,2024-07-02 21:21:00,2024-07-02,FALSE,FALSE,FALSE,FALSE,FALSE,FALSE
"Kruger 2 Canyons BR","Marakalala Site 3","Marakalala","Site 3","sunny","","",NA,75.4,"07/03/2024 10:07",NA,NA,NA,NA,NA,482,7.79,"pH reading indicates the water is suitable for irrigation",16.1,-24.52657563,30.71958245,838.630977,4.9,2024-07-03 10:07:00,2024-07-03,FALSE,FALSE,FALSE,FALSE,FALSE,FALSE
"Vhembe BR","Levubu River Tshakhuma2","Levubu River","Tshakhuma2","sunny","","",8.31,82.3,"07/04/2024 09:28",NA,NA,NA,NA,NA,348,7.86,"pH reading indicates the water is suitable for irrigation",20.9,-23.052945,30.296525,644.9,3.9,2024-07-04 09:28:00,2024-07-04,FALSE,FALSE,FALSE,FALSE,FALSE,FALSE
"Kruger 2 Canyons BR","Treur River Site 1","Treur River","Site 1","sunny","","",10.4,126.84,"07/04/2024 08:45",NA,NA,NA,NA,NA,53.6,7.94,"pH reading indicates the water is suitable for irrigation",13.2,-24.67523833,30.81141667,1103.2,2.5,2024-07-04 08:45:00,2024-07-04,FALSE,FALSE,FALSE,FALSE,FALSE,FALSE
"Kruger 2 Canyons BR","Mohlatsengwana Site 3","Mohlatsengwana","Site 3","sunny","","",8.46,NA,"07/04/2024 11:20",NA,NA,NA,NA,NA,57.3,8.78,"pH reading indicates the water is NOT suitable for irrigation",13.97,-24.6540853,31.044126,583.9,4.88,2024-07-04 11:20:00,2024-07-04,FALSE,FALSE,FALSE,FALSE,FALSE,FALSE
"Kruger 2 Canyons BR","Kubjaname Site 3","Kubjaname","Site 3","sunny","","",NA,83.87,"07/03/2024 10:05",NA,NA,NA,NA,NA,295,7.54,"pH reading indicates the water is suitable for irrigation",17.3,-24.3023322,30.5052525,583.2,4.8,2024-07-03 10:05:00,2024-07-03,FALSE,FALSE,FALSE,FALSE,FALSE,FALSE
"Kruger 2 Canyons BR","Mohlatsengwana Site 3","Mohlatsengwana","Site 3","sunny","","",8.46,NA,"07/04/2024 14:53",NA,NA,NA,NA,NA,57.3,8.78,"pH reading indicates the water is NOT suitable for irrigation",13.97,-24.6540853,31.044126,583.9,4.88,2024-07-04 14:53:00,2024-07-04,FALSE,FALSE,FALSE,FALSE,FALSE,FALSE
"Kruger 2 Canyons BR","Klaserie Site 1","Klaserie","Site 1","cloudy","","",0,0,"07/04/2024 15:00",NA,NA,NA,NA,NA,63.8,0,"pH reading indicates the water is NOT suitable for irrigation",15.1,-24.6060489,30.9702911,657.1,4.633,2024-07-04 15:00:00,2024-07-04,TRUE,FALSE,FALSE,FALSE,FALSE,TRUE
"Kruger 2 Canyons BR","Mohlatsengwana Site 2","Mohlatsengwana","Site 2","sunny","","",75.8,13.5,"07/04/2024 09:07",NA,NA,NA,NA,NA,410,7.9,"pH reading indicates the water is suitable for irrigation",13,-24.53950211,30.68940231,871.0946912,4.9,2024-07-04 09:07:00,2024-07-04,FALSE,TRUE,FALSE,FALSE,FALSE,TRUE
"Vhembe BR","Levubu River Mulenzhe site 2","Levubu River","Mulenzhe site 2","sunny","","",1.12,12.6,"07/05/2024 09:41",NA,NA,NA,NA,NA,148.6,8.29,"pH reading indicates the water is suitable for irrigation",17.4,-22.97169511,30.60346921,477.6829791,4.9,2024-07-05 09:41:00,2024-07-05,FALSE,FALSE,FALSE,FALSE,FALSE,FALSE
"Vhembe BR","Levubu River Mulenzhe site 2","Levubu River","Mulenzhe site 2","sunny","","Washing of clothes anda cars were done at the site",1.12,12.3,"07/05/2024 09:41",NA,NA,NA,NA,NA,148.6,8.29,"pH reading indicates the water is suitable for irrigation",17.4,-22.97166323,30.60341512,492.4163208,4.816192,2024-07-05 09:41:00,2024-07-05,FALSE,FALSE,FALSE,FALSE,FALSE,FALSE
"Vhembe BR","Levubu River Lambani site 1","Levubu River","Lambani site 1","partly_cloudy","","",NA,NA,"07/05/2024 09:52",NA,NA,NA,NA,NA,139.6,7.85,"pH reading indicates the water is suitable for irrigation",18,-22.7452463,30.884137,421.3,4.833,2024-07-05 09:52:00,2024-07-05,FALSE,FALSE,FALSE,FALSE,FALSE,FALSE
"Vhembe BR","Levubu River Halambani site 1","Levubu River","Halambani site 1","partly_cloudy","","",NA,NA,"07/05/2024 09:43",NA,NA,NA,NA,NA,139.6,7.85,"pH reading indicates the water is suitable for irrigation",18,-22.7454859,30.8844435,421.7,4.8,2024-07-05 09:43:00,2024-07-05,FALSE,FALSE,FALSE,FALSE,FALSE,FALSE
"Kruger 2 Canyons BR","Unnamed river No site name given","Unnamed river","No site name given","sunny","","Windy",9.76,118.3,"07/08/2024 09:32",NA,NA,NA,NA,NA,3.39,8.34,"pH reading indicates the water is suitable for irrigation",15.4,-24.66405667,30.79541,1165.1,2.8,2024-07-08 09:32:00,2024-07-08,FALSE,FALSE,FALSE,FALSE,FALSE,FALSE
"Kruger 2 Canyons BR","Klaserie Site 3","Klaserie","Site 3","sunny","","",11.5,NA,"07/08/2024 14:23",NA,NA,NA,NA,NA,40.3,NA,"pH reading indicates the water is NOT suitable for irrigation",14.3,-24.6043838,30.9754512,674.3,4.5,2024-07-08 14:23:00,2024-07-08,FALSE,FALSE,FALSE,FALSE,FALSE,FALSE
"Kruger 2 Canyons BR","Klaserie Site 2","Klaserie","Site 2","sunny","","",9.18,NA,"07/08/2024 14:24",NA,NA,NA,NA,NA,38.8,NA,"pH reading indicates the water is NOT suitable for irrigation",14.3,-24.6045378,30.9731678,688.8,4.4,2024-07-08 14:24:00,2024-07-08,FALSE,FALSE,FALSE,FALSE,FALSE,FALSE
"Kruger 2 Canyons BR","Moetladimo Moe001 US","Moetladimo","Moe001 US","other","Sunny and Windy","",NA,116.92,"07/09/2024 08:58",NA,NA,NA,NA,NA,126.7,7.73,"pH reading indicates the water is suitable for irrigation",12.3,-24.2663049,30.4493188,602.5,4.5,2024-07-09 08:58:00,2024-07-09,FALSE,FALSE,FALSE,FALSE,FALSE,FALSE
"Kruger 2 Canyons BR","Blyde river Blyde river","Blyde river","Blyde river","sunny","","",8.23,99.61,"07/10/2024 08:51",NA,NA,NA,NA,NA,165.3,7.94,"pH reading indicates the water is suitable for irrigation",11.9,-24.68012333,30.801825,1099.9,2.5,2024-07-10 08:51:00,2024-07-10,FALSE,FALSE,FALSE,FALSE,FALSE,FALSE
"Kruger 2 Canyons BR","Blyde river Blyde river","Blyde river","Blyde river","sunny","","Site 2",11.65,141,"07/10/2024 09:53",NA,NA,NA,NA,NA,166.2,7.94,"pH reading indicates the water is suitable for irrigation",11.3,-24.67903833,30.80239667,1103,4.6,2024-07-10 09:53:00,2024-07-10,FALSE,FALSE,FALSE,FALSE,FALSE,FALSE
"Kruger 2 Canyons BR","Kubjaname Site 3","Kubjaname","Site 3","sunny","","",NA,97.67,"07/10/2024 10:14",NA,NA,NA,NA,NA,320,7.63,"pH reading indicates the water is suitable for irrigation",14.5,-24.3022205,30.5053479,638.6,4.833,2024-07-10 10:14:00,2024-07-10,FALSE,FALSE,FALSE,FALSE,FALSE,FALSE
"Kruger 2 Canyons BR","Kubjaname Kub001 US","Kubjaname","Kub001 US","sunny","","",NA,94.77,"07/10/2024 10:16",NA,NA,NA,NA,NA,113.6,7.65,"pH reading indicates the water is suitable for irrigation",14.7,-24.3226412,30.4857946,610,4.75,2024-07-10 10:16:00,2024-07-10,FALSE,FALSE,FALSE,FALSE,FALSE,FALSE
"Kruger 2 Canyons BR","Olifants Site 1","Olifants","Site 1","sunny","","",NA,141.49,"07/11/2024 09:04",NA,NA,NA,NA,NA,537,8.59,"pH reading indicates the water is NOT suitable for irrigation",13.3,-24.3619567,30.6587183,504.7999878,5,2024-07-11 09:04:00,2024-07-11,FALSE,FALSE,FALSE,FALSE,FALSE,FALSE
"Kruger 2 Canyons BR","Olifants Oli001 US","Olifants","Oli001 US","other","Sunny and Windy","",NA,150.8,"07/11/2024 07:47",NA,NA,NA,NA,NA,532,8.59,"pH reading indicates the water is NOT suitable for irrigation",11.9,-24.4240023,30.5557818,530.3,4.7,2024-07-11 07:47:00,2024-07-11,FALSE,FALSE,FALSE,FALSE,FALSE,FALSE
"Kruger 2 Canyons BR","Treur River Site 1","Treur River","Site 1","sunny","","",11.31,136.89,"07/11/2024 10:21",NA,NA,NA,NA,NA,63.7,7.6,"pH reading indicates the water is suitable for irrigation",11.1,-24.67521167,30.81137167,1035.2,3.2,2024-07-11 10:21:00,2024-07-11,FALSE,FALSE,FALSE,FALSE,FALSE,FALSE
"Kruger 2 Canyons BR","Mohlatsengwana Site 3","Mohlatsengwana","Site 3","sunny","","",14.88,11,"07/11/2024 10:09",NA,NA,NA,NA,NA,57.3,NA,"pH reading indicates the water is NOT suitable for irrigation",11,-24.6541266,31.0440786,583.6,4.4,2024-07-11 10:09:00,2024-07-11,FALSE,FALSE,FALSE,FALSE,FALSE,FALSE
"Kruger 2 Canyons BR","Mohlatsengwana Site 1","Mohlatsengwana","Site 1","sunny","","",13.88,11.8,"07/11/2024 09:40",NA,NA,NA,NA,NA,53.5,NA,"pH reading indicates the water is NOT suitable for irrigation",11.8,-24.6530921,31.0398757,596.5,4.166,2024-07-11 09:40:00,2024-07-11,FALSE,FALSE,FALSE,FALSE,FALSE,FALSE
"Kruger 2 Canyons BR","Motlamogatsana Site 1","Motlamogatsana","Site 1","sunny","","",10.34,NA,"07/04/2024 10:28",NA,NA,NA,NA,NA,56.7,8.62,"pH reading indicates the water is NOT suitable for irrigation",14.6,-24.653105,31.0398534,592.9,3.9,2024-07-04 10:28:00,2024-07-04,FALSE,FALSE,FALSE,FALSE,FALSE,FALSE
"Vhembe BR","Levubu River Tshakhuma1","Levubu River","Tshakhuma1","cloudy","","",6.21,63.2,"07/16/2024 09:52",NA,NA,NA,NA,NA,NA,8.05,"pH reading indicates the water is suitable for irrigation",17.1,-23.054107,30.2969288,664,5,2024-07-16 09:52:00,2024-07-16,FALSE,FALSE,FALSE,FALSE,FALSE,FALSE
"Vhembe BR","Levubu River Mulenzhe site 1","Levubu River","Mulenzhe site 1","cloudy","","",1.02,11.2,"07/16/2024 10:14",NA,NA,NA,NA,NA,164.5,8.12,"pH reading indicates the water is suitable for irrigation",17,-22.97115551,30.60374676,486.3719564,4.9,2024-07-16 10:14:00,2024-07-16,FALSE,FALSE,FALSE,FALSE,FALSE,FALSE
"Vhembe BR","Levubu River Mulenzhe site 1","Levubu River","Mulenzhe site 1","cloudy","","",1.02,11.2,"07/16/2024 10:14",NA,NA,NA,NA,NA,164.5,8.12,"pH reading indicates the water is suitable for irrigation",17,-22.9712333,30.6037293,507.2999878,4.858,2024-07-16 10:14:00,2024-07-16,FALSE,FALSE,FALSE,FALSE,FALSE,FALSE
"Kruger 2 Canyons BR","Blyde river Blyde river","Blyde river","Blyde river","sunny","","",9.4,113.77,"07/17/2024 08:11",NA,NA,NA,NA,NA,15.95,8.08,"pH reading indicates the water is suitable for irrigation",13.2,-24.680005,30.80180167,1088.1,3.6,2024-07-17 08:11:00,2024-07-17,FALSE,FALSE,FALSE,FALSE,FALSE,FALSE
"Kruger 2 Canyons BR","Blyde river Blyde river","Blyde river","Blyde river","sunny","","",11.2,NA,"07/17/2024 09:01",NA,NA,NA,NA,NA,167.6,8.05,"pH reading indicates the water is suitable for irrigation",12.7,-24.67899167,30.802405,1099.3,2.2,2024-07-17 09:01:00,2024-07-17,FALSE,FALSE,FALSE,FALSE,FALSE,FALSE
"Kruger 2 Canyons BR","Blyde river Blyde river","Blyde river","Blyde river","sunny","","",11.2,135.55,"07/17/2024 09:02",NA,NA,NA,NA,NA,167.6,8.05,"pH reading indicates the water is suitable for irrigation",12.7,-24.67899167,30.802405,1099.3,2.2,2024-07-17 09:02:00,2024-07-17,FALSE,FALSE,FALSE,FALSE,FALSE,FALSE
"Kruger 2 Canyons BR","Kubjaname Site 3","Kubjaname","Site 3","sunny","","",NA,67.17,"07/17/2024 10:48",NA,NA,NA,NA,NA,328,8,"pH reading indicates the water is suitable for irrigation",18,-24.302277,30.5052148,642.8,3.34,2024-07-17 10:48:00,2024-07-17,FALSE,FALSE,FALSE,FALSE,FALSE,FALSE
"Vhembe BR","Levubu River Lambani site 1","Levubu River","Lambani site 1","sunny","","",NA,NA,"07/17/2024 10:56",NA,NA,NA,NA,NA,128.5,7.63,"pH reading indicates the water is suitable for irrigation",17.5,-22.7454468,30.884605,448.9,4.82,2024-07-17 10:56:00,2024-07-17,FALSE,FALSE,FALSE,FALSE,FALSE,FALSE
"Vhembe BR","Levubu River Lambani site 1","Levubu River","Lambani site 1","sunny","","",NA,NA,"07/18/2024 07:38",NA,NA,NA,NA,NA,128.5,7.63,"pH reading indicates the water is suitable for irrigation",17.5,-22.7454468,30.884605,448.9,4.82,2024-07-18 07:38:00,2024-07-18,FALSE,FALSE,FALSE,FALSE,FALSE,FALSE
"Kruger 2 Canyons BR","Olifants Oli001 US","Olifants","Oli001 US","sunny","","",NA,103.84,"07/18/2024 08:07",NA,NA,NA,NA,NA,548,8.6,"pH reading indicates the water is NOT suitable for irrigation",15.2,-24.4240305,30.5557343,536.2,4.766,2024-07-18 08:07:00,2024-07-18,FALSE,FALSE,FALSE,FALSE,FALSE,FALSE
"Kruger 2 Canyons BR","Kubjaname Kub001 US","Kubjaname","Kub001 US","sunny","","",NA,75.4,"07/17/2024 11:01",NA,NA,NA,NA,NA,107.4,7.75,"pH reading indicates the water is suitable for irrigation",16.2,-24.32285,30.4858483,703,4.6,2024-07-17 11:01:00,2024-07-17,FALSE,FALSE,FALSE,FALSE,FALSE,FALSE
"Kruger 2 Canyons BR","Motlamogatsana Site 1","Motlamogatsana","Site 1","sunny","","",10.19,14.1,"07/18/2024 09:32",NA,NA,NA,NA,NA,57.6,8.88,"pH reading indicates the water is NOT suitable for irrigation",13.8,-24.6531291,31.0398471,600.6,4.05,2024-07-18 09:32:00,2024-07-18,FALSE,FALSE,FALSE,FALSE,FALSE,FALSE
"Vhembe BR","Levubu River Tshakhuma1","Levubu River","Tshakhuma1","sunny","","",8.67,84,"07/18/2024 09:41",NA,NA,NA,NA,NA,95,7.26,"pH reading indicates the water is suitable for irrigation",20.1,-23.0529785,30.2965635,660,4.75,2024-07-18 09:41:00,2024-07-18,FALSE,FALSE,FALSE,FALSE,FALSE,FALSE
"Kruger 2 Canyons BR","Treur River Site 2","Treur River","Site 2","sunny","","",8.97,NA,"07/18/2024 10:15",NA,NA,NA,NA,NA,60.3,8.64,"pH reading indicates the water is NOT suitable for irrigation",12.8,-24.68773333,30.81285,1139.7,3.9,2024-07-18 10:15:00,2024-07-18,FALSE,FALSE,FALSE,FALSE,FALSE,FALSE
"Kruger 2 Canyons BR","Treur River Site 1","Treur River","Site 1","sunny","","",59.6,14,"07/18/2024 10:27",NA,NA,NA,NA,NA,10.35,8.31,"pH reading indicates the water is suitable for irrigation",14,-24.67519,30.81154333,1112.4,4.1,2024-07-18 10:27:00,2024-07-18,FALSE,TRUE,FALSE,FALSE,FALSE,TRUE
"Kruger 2 Canyons BR","Mohlatsengwana Site 3","Mohlatsengwana","Site 3","sunny","","",10.6,13.9,"07/18/2024 10:17",NA,NA,NA,NA,NA,56,8.28,"pH reading indicates the water is suitable for irrigation",13.7,-24.6540527,31.0441936,588.1,3.946,2024-07-18 10:17:00,2024-07-18,FALSE,FALSE,FALSE,FALSE,FALSE,FALSE
"Kruger 2 Canyons BR","Olifants Site 1","Olifants","Site 1","sunny","","",NA,119.09,"07/18/2024 12:52",NA,NA,NA,NA,NA,542,8.55,"pH reading indicates the water is NOT suitable for irrigation",15.6,-24.361881,30.6586779,489.5,4.333,2024-07-18 12:52:00,2024-07-18,FALSE,FALSE,FALSE,FALSE,FALSE,FALSE
"Kruger 2 Canyons BR","Mohlatsengwana Site 2","Mohlatsengwana","Site 2","sunny","","",81.2,NA,"07/18/2024 10:13",NA,NA,NA,NA,NA,596,7.7,"pH reading indicates the water is suitable for irrigation",13.8,-24.53960037,30.68936646,898.5980982,4.9,2024-07-18 10:13:00,2024-07-18,FALSE,TRUE,FALSE,FALSE,FALSE,TRUE
"Kruger 2 Canyons BR","Mohlatsengwana Site 1","Mohlatsengwana","Site 1","sunny","","",75.6,NA,"07/18/2024 08:46",NA,NA,NA,NA,NA,485,7.39,"pH reading indicates the water is suitable for irrigation",13.1,-24.55192131,30.67538717,861.4477862,4.9,2024-07-18 08:46:00,2024-07-18,FALSE,TRUE,FALSE,FALSE,FALSE,TRUE
"Vhembe BR","Levubu River Halambani site 1","Levubu River","Halambani site 1","sunny","","",NA,NA,"07/19/2024 10:11",NA,NA,NA,NA,NA,112,7.84,"pH reading indicates the water is suitable for irrigation",17.3,-22.7454063,30.8846055,460.3,4.766,2024-07-19 10:11:00,2024-07-19,FALSE,FALSE,FALSE,FALSE,FALSE,FALSE
"Vhembe BR","Levubu River Halambani site 1","Levubu River","Halambani site 1","sunny","","",NA,NA,"07/19/2024 10:32",NA,NA,NA,NA,NA,112,7.84,"pH reading indicates the water is suitable for irrigation",17.3,-22.7454847,30.8844657,426,4.366,2024-07-19 10:32:00,2024-07-19,FALSE,FALSE,FALSE,FALSE,FALSE,FALSE
"Vhembe BR","Levubu River Halambani site 1","Levubu River","Halambani site 1","sunny","","",NA,NA,"07/17/2024 10:57",NA,NA,NA,NA,NA,128.5,7.63,"pH reading indicates the water is suitable for irrigation",17.5,-22.7455028,30.8845416,418.3,4.65,2024-07-17 10:57:00,2024-07-17,FALSE,FALSE,FALSE,FALSE,FALSE,FALSE
"Vhembe BR","Levubu River Halambani site 1","Levubu River","Halambani site 1","partly_cloudy","","",NA,NA,"07/05/2024 09:43",NA,NA,NA,NA,NA,139.6,7.85,"pH reading indicates the water is suitable for irrigation",18,-22.7454447,30.8844872,433.8,4.833,2024-07-05 09:43:00,2024-07-05,FALSE,FALSE,FALSE,FALSE,FALSE,FALSE
"Vhembe BR","Levubu River Lambani site 1","Levubu River","Lambani site 1","sunny","","",NA,NA,"07/19/2024 10:11",NA,NA,NA,NA,NA,112,7.84,"pH reading indicates the water is suitable for irrigation",17.3,-22.7454724,30.8845658,440.8,3.766,2024-07-19 10:11:00,2024-07-19,FALSE,FALSE,FALSE,FALSE,FALSE,FALSE
"Kruger 2 Canyons BR","Moremela site 1 Moremela site 1","Moremela site 1","Moremela site 1","partly_cloudy","","",108.69,17.3,"07/22/2024 08:47",NA,NA,NA,NA,NA,32.6,8.33,"pH reading indicates the water is suitable for irrigation",18,-24.66408167,30.795445,1156,2.1,2024-07-22 08:47:00,2024-07-22,FALSE,TRUE,FALSE,FALSE,FALSE,TRUE
"Kruger 2 Canyons BR","Moremela site 2 Moremela site 2","Moremela site 2","Moremela site 2","partly_cloudy","","",8.98,108.69,"07/22/2024 11:09",NA,NA,NA,NA,NA,32.6,8.33,"pH reading indicates the water is suitable for irrigation",17.1,-24.67612333,30.80349,1122.7,2.5,2024-07-22 11:09:00,2024-07-22,FALSE,FALSE,FALSE,FALSE,FALSE,FALSE
"Kruger 2 Canyons BR","Klaserie Kla001","Klaserie","Kla001","sunny","","",NA,NA,"07/22/2024 09:51",NA,NA,NA,NA,NA,38.9,9.7,"pH reading indicates the water is NOT suitable for irrigation",16.1,-24.6073156,30.9578815,682.7,4.666,2024-07-22 09:51:00,2024-07-22,FALSE,FALSE,FALSE,FALSE,FALSE,FALSE
"Kruger 2 Canyons BR","Klaserie Site 1","Klaserie","Site 1","sunny","","",17.52,NA,"07/22/2024 10:45",NA,NA,NA,NA,NA,38.7,8.25,"pH reading indicates the water is suitable for irrigation",16.7,-24.6059316,30.9703889,679.4,4.96,2024-07-22 10:45:00,2024-07-22,FALSE,FALSE,FALSE,FALSE,FALSE,FALSE
"Kruger 2 Canyons BR","Klaserie Site 2","Klaserie","Site 2","sunny","","",NA,NA,"07/22/2024 11:20",NA,NA,NA,NA,NA,39.9,7.09,"pH reading indicates the water is suitable for irrigation",17.3,-24.6044992,30.9730253,676.7,3.35,2024-07-22 11:20:00,2024-07-22,FALSE,FALSE,FALSE,FALSE,FALSE,FALSE
"Kruger 2 Canyons BR","Klaserie Site 3","Klaserie","Site 3","sunny","","",NA,NA,"07/22/2024 11:56",NA,NA,NA,NA,NA,38.9,7.52,"pH reading indicates the water is suitable for irrigation",17.4,-24.6044293,30.9754307,674.7,4.466,2024-07-22 11:56:00,2024-07-22,FALSE,FALSE,FALSE,FALSE,FALSE,FALSE
"Kruger 2 Canyons BR","Blyde river Blyde river","Blyde river","Blyde river","sunny","","",8.72,105.54,"07/24/2024 08:30",NA,NA,NA,NA,NA,167.5,8.28,"pH reading indicates the water is suitable for irrigation",15,-24.68007833,30.80199833,1112.5,3.5,2024-07-24 08:30:00,2024-07-24,FALSE,FALSE,FALSE,FALSE,FALSE,FALSE
"Kruger 2 Canyons BR","Blyde river Blyde river","Blyde river","Blyde river","sunny","","",10.87,131.56,"07/24/2024 09:09",NA,NA,NA,NA,NA,167.8,8.08,"pH reading indicates the water is suitable for irrigation",14.68,-24.67906667,30.802435,1113,2.9,2024-07-24 09:09:00,2024-07-24,FALSE,FALSE,FALSE,FALSE,FALSE,FALSE
"Kruger 2 Canyons BR","Kubjaname Site 3","Kubjaname","Site 3","sunny","","",NA,82.66,"07/24/2024 09:52",NA,NA,NA,NA,NA,322,7.56,"pH reading indicates the water is suitable for irrigation",20.6,-24.3023224,30.5052414,634.2,1.96,2024-07-24 09:52:00,2024-07-24,FALSE,FALSE,FALSE,FALSE,FALSE,FALSE
"Kruger 2 Canyons BR","Kubjaname Kub001 US","Kubjaname","Kub001 US","sunny","","",NA,87.14,"07/24/2024 09:26",NA,NA,NA,NA,NA,116.2,7.53,"pH reading indicates the water is suitable for irrigation",17.4,-24.3226983,30.48583,735.4,5,2024-07-24 09:26:00,2024-07-24,FALSE,FALSE,FALSE,FALSE,FALSE,FALSE
"Kruger 2 Canyons BR","Moetladimo Site 1","Moetladimo","Site 1","sunny","","",NA,81.45,"07/24/2024 09:28",NA,NA,NA,NA,NA,123.7,8.01,"pH reading indicates the water is suitable for irrigation",20.6,-24.2587072,30.4538152,595.5,2.3,2024-07-24 09:28:00,2024-07-24,FALSE,FALSE,FALSE,FALSE,FALSE,FALSE
"Kruger 2 Canyons BR","Moetladimo Moe001 US","Moetladimo","Moe001 US","sunny","","",NA,91.02,"07/24/2024 09:28",NA,NA,NA,NA,NA,125.5,7.94,"pH reading indicates the water is suitable for irrigation",17.5,-24.2663376,30.4493527,601.9,4.85,2024-07-24 09:28:00,2024-07-24,FALSE,FALSE,FALSE,FALSE,FALSE,FALSE
"Kruger 2 Canyons BR","Marakalala Site 3","Marakalala","Site 3","sunny","","",30.7,NA,"07/24/2024 10:37",NA,NA,NA,NA,NA,514,7.05,"pH reading indicates the water is suitable for irrigation",18.5,-24.5265952,30.71943364,839.8587849,4.9,2024-07-24 10:37:00,2024-07-24,FALSE,TRUE,FALSE,FALSE,FALSE,TRUE
"Kruger 2 Canyons BR","Marakalala Site 1","Marakalala","Site 1","sunny","","",15.1,NA,"07/24/2024 11:54",NA,NA,NA,NA,NA,242,6.44,"pH reading indicates the water is NOT suitable for irrigation",21.8,-24.52280653,30.7072691,853.8498009,4.9,2024-07-24 11:54:00,2024-07-24,FALSE,FALSE,FALSE,FALSE,FALSE,FALSE
"Kruger 2 Canyons BR","Treur River Site 2","Treur River","Site 2","sunny","","",9.98,120.79,"07/25/2024 08:32",NA,NA,NA,NA,NA,65.7,7.81,"pH reading indicates the water is suitable for irrigation",13.9,-24.68775333,30.81287333,1148.6,4.5,2024-07-25 08:32:00,2024-07-25,FALSE,FALSE,FALSE,FALSE,FALSE,FALSE
"Kruger 2 Canyons BR","Treur River Site 1","Treur River","Site 1","sunny","","",10.19,122.33,"07/25/2024 10:19",NA,NA,NA,NA,NA,68,8.12,"pH reading indicates the water is suitable for irrigation",16.1,-24.675395,30.81169667,1108.7,2.5,2024-07-25 10:19:00,2024-07-25,FALSE,FALSE,FALSE,FALSE,FALSE,FALSE
"Kruger 2 Canyons BR","Mohlatsengwana Site 2","Mohlatsengwana","Site 2","partly_cloudy","","",37.2,NA,"07/25/2024 10:02",NA,NA,NA,NA,NA,538,7.58,"pH reading indicates the water is suitable for irrigation",15.8,-24.53956496,30.68933435,869.3872274,4.9,2024-07-25 10:02:00,2024-07-25,FALSE,TRUE,FALSE,FALSE,FALSE,TRUE
"Kruger 2 Canyons BR","Mohlatsengwana Site 3","Mohlatsengwana","Site 3","partly_cloudy","","",14.7,NA,"07/25/2024 09:21",NA,NA,NA,NA,NA,510,7.77,"pH reading indicates the water is suitable for irrigation",15.3,-24.54065485,30.69551544,865.9006269,4.9,2024-07-25 09:21:00,2024-07-25,FALSE,FALSE,FALSE,FALSE,FALSE,FALSE
"Kruger 2 Canyons BR","Moremela site 1 Moremela site 1","Moremela site 1","Moremela site 1","sunny","","",9.03,109.29,"07/29/2024 08:21",NA,NA,NA,NA,NA,3.48,8.22,"pH reading indicates the water is suitable for irrigation",13.5,-24.66392833,30.79549667,1116.6,3.4,2024-07-29 08:21:00,2024-07-29,FALSE,FALSE,FALSE,FALSE,FALSE,FALSE
"Kruger 2 Canyons BR","Motlamogatsana Site 3","Motlamogatsana","Site 3","sunny","","",NA,NA,"07/25/2024 12:03",NA,NA,NA,NA,NA,74.1,8.57,"pH reading indicates the water is NOT suitable for irrigation",16.4,-24.654057,31.0441295,585.9,3.137,2024-07-25 12:03:00,2024-07-25,FALSE,FALSE,FALSE,FALSE,FALSE,FALSE
"Kruger 2 Canyons BR","Motlamogatsana Site 1","Motlamogatsana","Site 1","sunny","","",0,0,"07/25/2024 11:11",NA,NA,NA,NA,NA,71.7,8.22,"pH reading indicates the water is suitable for irrigation",17.2,-24.6530716,31.0399707,627.4,4.55,2024-07-25 11:11:00,2024-07-25,FALSE,FALSE,FALSE,FALSE,FALSE,FALSE
"Kruger 2 Canyons BR","Moremela site 2 Moremela site 2","Moremela site 2","Moremela site 2","sunny","","",10.97,132.77,"07/29/2024 11:26",NA,NA,NA,NA,NA,32.4,8.24,"pH reading indicates the water is suitable for irrigation",15.1,-24.67620667,30.80342,1131.7,2.3,2024-07-29 11:26:00,2024-07-29,FALSE,FALSE,FALSE,FALSE,FALSE,FALSE
"Kruger 2 Canyons BR","Moetladimo Site 1","Moetladimo","Site 1","sunny","","",NA,69.11,"07/30/2024 09:55",NA,NA,NA,NA,NA,116.8,8.17,"pH reading indicates the water is suitable for irrigation",18.1,-24.2587182,30.4536534,616.3999634,4.475,2024-07-30 09:55:00,2024-07-30,FALSE,FALSE,FALSE,FALSE,FALSE,FALSE
"Kruger 2 Canyons BR","Moetladimo Moe001 US","Moetladimo","Moe001 US","sunny","","",NA,61.12,"07/30/2024 08:43",NA,NA,NA,NA,NA,128.1,7.77,"pH reading indicates the water is suitable for irrigation",16.5,-24.2663994,30.4492969,602,4.583,2024-07-30 08:43:00,2024-07-30,FALSE,FALSE,FALSE,FALSE,FALSE,FALSE
"Kruger 2 Canyons BR","Blyde river Blyde river","Blyde river","Blyde river","partly_cloudy","","",9.68,117.16,"07/31/2024 12:25",NA,NA,NA,NA,NA,168.5,8.57,"pH reading indicates the water is NOT suitable for irrigation",15.2,-24.67998833,30.80190667,1111.8,1.9,2024-07-31 12:25:00,2024-07-31,FALSE,FALSE,FALSE,FALSE,FALSE,FALSE
"Kruger 2 Canyons BR","Blyde river Blyde river","Blyde river","Blyde river","partly_cloudy","","",11.16,135.07,"07/31/2024 12:56",NA,NA,NA,NA,NA,170.6,7.98,"pH reading indicates the water is suitable for irrigation",16.2,-24.67903167,30.802455,1099.5,2.7,2024-07-31 12:56:00,2024-07-31,FALSE,FALSE,FALSE,FALSE,FALSE,FALSE
"Kruger 2 Canyons BR","Kubjaname Site 3","Kubjaname","Site 3","cloudy","","",NA,78.07,"07/31/2024 13:32",NA,NA,NA,NA,NA,337,7.24,"pH reading indicates the water is suitable for irrigation",18.8,-24.3023049,30.50525,628.1,3.3,2024-07-31 13:32:00,2024-07-31,FALSE,FALSE,FALSE,FALSE,FALSE,FALSE
"Kruger 2 Canyons BR","Mohlatsengwana Site 3","Mohlatsengwana","Site 3","partly_cloudy","","",12.6,NA,"07/31/2024 09:26",NA,NA,NA,NA,NA,550,7.69,"pH reading indicates the water is suitable for irrigation",14.9,-24.54060173,30.69546865,869.9107645,4.9,2024-07-31 09:26:00,2024-07-31,FALSE,FALSE,FALSE,FALSE,FALSE,FALSE
"Kruger 2 Canyons BR","Mohlatsengwana Site 1","Mohlatsengwana","Site 1","partly_cloudy","","",74.7,NA,"07/31/2024 11:02",NA,NA,NA,NA,NA,611,7.64,"pH reading indicates the water is suitable for irrigation",15.6,-24.55189112,30.67545515,873.1243568,4.9,2024-07-31 11:02:00,2024-07-31,FALSE,TRUE,FALSE,FALSE,FALSE,TRUE
"Kruger 2 Canyons BR","Kubjaname Kub001 US","Kubjaname","Kub001 US","cloudy","","",NA,80.34,"07/31/2024 09:41",NA,NA,NA,NA,NA,115,7.63,"pH reading indicates the water is suitable for irrigation",16.4,-24.3228413,30.485895,695.6,4.825,2024-07-31 09:41:00,2024-07-31,FALSE,FALSE,FALSE,FALSE,FALSE,FALSE
"Kruger 2 Canyons BR","Treur River Site 2","Treur River","Site 2","sunny","","",9.06,109.65,"08/01/2024 08:29",NA,NA,NA,NA,NA,62.3,7.87,"pH reading indicates the water is suitable for irrigation",14.1,-24.68770333,30.81287667,1138.8,2,2024-08-01 08:29:00,2024-08-01,FALSE,FALSE,FALSE,FALSE,FALSE,FALSE
"Kruger 2 Canyons BR","Treur River Site 1","Treur River","Site 1","sunny","","",9.97,120.67,"08/01/2024 10:05",NA,NA,NA,NA,NA,64.1,7.84,"pH reading indicates the water is suitable for irrigation",15.6,-24.67532,30.81158333,1118.3,2,2024-08-01 10:05:00,2024-08-01,FALSE,FALSE,FALSE,FALSE,FALSE,FALSE
"Kruger 2 Canyons BR","Olifants Site 1","Olifants","Site 1","cloudy","","",NA,123.57,"08/01/2024 09:48",NA,NA,NA,NA,NA,551,8.22,"pH reading indicates the water is suitable for irrigation",17.6,-24.3619573,30.6586896,482,4.6,2024-08-01 09:48:00,2024-08-01,FALSE,FALSE,FALSE,FALSE,FALSE,FALSE
"Kruger 2 Canyons BR","Klaserie Site 2","Klaserie","Site 2","partly_cloudy","","",18.43,NA,"07/29/2024 11:12",NA,NA,NA,NA,NA,52.7,12.2,"pH reading indicates the water is NOT suitable for irrigation",13.6,-24.6059652,30.9704029,707.2,4.85,2024-07-29 11:12:00,2024-07-29,TRUE,FALSE,FALSE,FALSE,FALSE,TRUE
"Kruger 2 Canyons BR","Klaserie Site 3","Klaserie","Site 3","sunny","","",13.97,NA,"07/29/2024 11:00",NA,NA,NA,NA,NA,52.9,10.15,"pH reading indicates the water is NOT suitable for irrigation",14.1,-24.6044957,30.9730323,670.2,3.966,2024-07-29 11:00:00,2024-07-29,TRUE,FALSE,FALSE,FALSE,FALSE,TRUE
"Kruger 2 Canyons BR","Klaserie Site 3","Klaserie","Site 3","sunny","","",NA,NA,"07/29/2024 11:32",NA,NA,NA,NA,NA,54.1,11.86,"pH reading indicates the water is NOT suitable for irrigation",14.1,-24.6043976,30.9754157,680.6,4.916,2024-07-29 11:32:00,2024-07-29,TRUE,FALSE,FALSE,FALSE,FALSE,TRUE
"Kruger 2 Canyons BR","Klaserie Kla001","Klaserie","Kla001","partly_cloudy","","",NA,6.85,"07/29/2024 09:13",NA,NA,NA,NA,NA,50.7,12.64,"pH reading indicates the water is NOT suitable for irrigation",12.7,-24.6068371,30.9580747,739.3,4.887,2024-07-29 09:13:00,2024-07-29,TRUE,FALSE,FALSE,FALSE,FALSE,TRUE
"Kruger 2 Canyons BR","Marakalala Site 3","Marakalala","Site 3","cloudy","","",74.1,18.3,"08/01/2024 09:39",NA,NA,NA,NA,NA,510,7.62,"pH reading indicates the water is suitable for irrigation",17.4,-24.52651895,30.71958938,842.0186449,4.9,2024-08-01 09:39:00,2024-08-01,FALSE,TRUE,FALSE,FALSE,FALSE,TRUE
"Kruger 2 Canyons BR","Marakalala Site 1","Marakalala","Site 1","cloudy","","",18.8,NA,"08/01/2024 10:54",NA,NA,NA,NA,NA,248,6.56,"pH reading indicates the water is suitable for irrigation",16.4,-24.52279366,30.70730014,850.9989435,4.9,2024-08-01 10:54:00,2024-08-01,FALSE,FALSE,FALSE,FALSE,FALSE,FALSE
"Kruger 2 Canyons BR","Moremela site 1 Moremela site 1","Moremela site 1","Moremela site 1","sunny","","",9.46,114.5,"08/05/2024 08:32",NA,NA,NA,NA,NA,339,8.46,"pH reading indicates the water is suitable for irrigation",16.2,-24.66407667,30.79548667,1164.2,2.3,2024-08-05 08:32:00,2024-08-05,FALSE,FALSE,FALSE,FALSE,FALSE,FALSE
"Kruger 2 Canyons BR","Motlamogatsana Site 1","Motlamogatsana","Site 1","partly_cloudy","","",2.22,NA,"08/01/2024 10:46",NA,NA,NA,NA,NA,90.9,5.53,"pH reading indicates the water is NOT suitable for irrigation",16.4,-24.6530996,31.0398722,606.1,3.985,2024-08-01 10:46:00,2024-08-01,FALSE,FALSE,FALSE,FALSE,FALSE,FALSE
"Kruger 2 Canyons BR","Motlamogatsana Site 3","Motlamogatsana","Site 3","cloudy","","",1.78,15.8,"08/01/2024 11:29",NA,NA,NA,NA,NA,91.4,5.43,"pH reading indicates the water is NOT suitable for irrigation",15.6,-24.6541543,31.044178,622.4,4.025,2024-08-01 11:29:00,2024-08-01,FALSE,FALSE,FALSE,FALSE,FALSE,FALSE
"Kruger 2 Canyons BR","Moremela site 2 Moremela site 2","Moremela site 2","Moremela site 2","sunny","","",10.39,125.75,"08/05/2024 10:41",NA,NA,NA,NA,NA,316,8.22,"pH reading indicates the water is suitable for irrigation",16.7,-24.67611833,30.80344333,1137.7,2.6,2024-08-05 10:41:00,2024-08-05,FALSE,FALSE,FALSE,FALSE,FALSE,FALSE
"Kruger 2 Canyons BR","Klaserie Site 2","Klaserie","Site 2","cloudy","","",NA,NA,"08/05/2024 11:47",NA,NA,NA,NA,NA,51.2,6.62,"pH reading indicates the water is suitable for irrigation",17.2,-24.6044781,30.9729983,681,2.62,2024-08-05 11:47:00,2024-08-05,FALSE,FALSE,FALSE,FALSE,FALSE,FALSE
"Kruger 2 Canyons BR","Klaserie Kla001","Klaserie","Kla001","partly_cloudy","","",NA,NA,"08/05/2024 09:44",NA,NA,NA,NA,NA,48.7,6.53,"pH reading indicates the water is suitable for irrigation",167,-24.6073303,30.9577075,699.3,4.633,2024-08-05 09:44:00,2024-08-05,FALSE,FALSE,FALSE,FALSE,TRUE,TRUE
"Kruger 2 Canyons BR","Klaserie Site 3","Klaserie","Site 3","cloudy","","",NA,NA,"08/05/2024 12:08",NA,NA,NA,NA,NA,51.2,6.79,"pH reading indicates the water is suitable for irrigation",17.2,-24.6043565,30.9753679,675.6,2.52,2024-08-05 12:08:00,2024-08-05,FALSE,FALSE,FALSE,FALSE,FALSE,FALSE
"Kruger 2 Canyons BR","Moetladimo Moe001 US","Moetladimo","Moe001 US","light_rain","","",NA,97.19,"08/06/2024 08:10",NA,NA,NA,NA,NA,131.4,7.49,"pH reading indicates the water is suitable for irrigation",18,-24.2663404,30.4493792,619.2,4.825,2024-08-06 08:10:00,2024-08-06,FALSE,FALSE,FALSE,FALSE,FALSE,FALSE
"Kruger 2 Canyons BR","Olifants Oli001 US","Olifants","Oli001 US","cloudy","","",NA,106.87,"08/01/2024 13:42",NA,NA,NA,NA,NA,556,8.6,"pH reading indicates the water is NOT suitable for irrigation",16.5,-24.4240534,30.5557074,528.9,4.8,2024-08-01 13:42:00,2024-08-01,FALSE,FALSE,FALSE,FALSE,FALSE,FALSE
"Kruger 2 Canyons BR","Moetladimo Site 1","Moetladimo","Site 1","cloudy","","",NA,101.42,"08/06/2024 09:47",NA,NA,NA,NA,NA,127.3,7.65,"pH reading indicates the water is suitable for irrigation",17.9,-24.2586673,30.453796,602.8,4.733,2024-08-06 09:47:00,2024-08-06,FALSE,FALSE,FALSE,FALSE,FALSE,FALSE
"Kruger 2 Canyons BR","Klaserie Kla004 DS","Klaserie","Kla004 DS","cloudy","","",NA,NA,"08/05/2024 13:56",NA,NA,NA,NA,NA,54.8,6.58,"pH reading indicates the water is suitable for irrigation",18,-24.5917908,30.9878876,594.2,4.64,2024-08-05 13:56:00,2024-08-05,FALSE,FALSE,FALSE,FALSE,FALSE,FALSE
"Kruger 2 Canyons BR","Mohlatsengwana Site 2","Mohlatsengwana","Site 2","sunny","","",84.4,NA,"08/07/2024 09:57",NA,NA,NA,NA,NA,529,NA,"pH reading indicates the water is NOT suitable for irrigation",NA,-24.53953748,30.68920211,853.8606864,4.7,2024-08-07 09:57:00,2024-08-07,FALSE,TRUE,FALSE,FALSE,FALSE,TRUE
"Kruger 2 Canyons BR","Treur River Site 1","Treur River","Site 1","sunny","","",NA,121.64,"08/08/2024 08:44",NA,NA,NA,NA,NA,56.3,8.6,"pH reading indicates the water is NOT suitable for irrigation",14.6,-24.67537167,30.81131667,1126.3,3.3,2024-08-08 08:44:00,2024-08-08,FALSE,FALSE,FALSE,FALSE,FALSE,FALSE
"Kruger 2 Canyons BR","Motlamogatsana Site 1","Motlamogatsana","Site 1","sunny","","",5.76,NA,"08/08/2024 11:35",NA,NA,NA,NA,NA,145.1,6.66,"pH reading indicates the water is suitable for irrigation",17.5,-24.6530091,31.0398209,597.5,4.7,2024-08-08 11:35:00,2024-08-08,FALSE,FALSE,FALSE,FALSE,FALSE,FALSE
"Kruger 2 Canyons BR","Treur River Site 2","Treur River","Site 2","sunny","","",NA,110.28,"08/08/2024 10:28",NA,NA,NA,NA,NA,67.5,7.8,"pH reading indicates the water is suitable for irrigation",15.1,-24.68772,30.81292167,1160.8,2,2024-08-08 10:28:00,2024-08-08,FALSE,FALSE,FALSE,FALSE,FALSE,FALSE
"Kruger 2 Canyons BR","Moremela site 1 Moremela site 1","Moremela site 1","Moremela site 1","sunny","","",8.42,95.01,"08/12/2024 09:00",NA,NA,NA,NA,NA,332,8.42,"pH reading indicates the water is suitable for irrigation",16.2,-24.66409167,30.79549,1166.5,4.4,2024-08-12 09:00:00,2024-08-12,FALSE,FALSE,FALSE,FALSE,FALSE,FALSE
"Kruger 2 Canyons BR","Moremela site 2 Moremela site 2","Moremela site 2","Moremela site 2","sunny","","",8.24,99.73,"08/12/2024 10:24",NA,NA,NA,NA,NA,315,8.32,"pH reading indicates the water is suitable for irrigation",16.6,-24.676185,30.803465,1111.4,4.2,2024-08-12 10:24:00,2024-08-12,FALSE,FALSE,FALSE,FALSE,FALSE,FALSE
"Kruger 2 Canyons BR","Klaserie Kla001","Klaserie","Kla001","sunny","","",5.4,NA,"08/12/2024 11:58",NA,NA,NA,NA,NA,69.3,7.77,"pH reading indicates the water is suitable for irrigation",16.6,-24.6071382,30.9578764,711.1,4.8,2024-08-12 11:58:00,2024-08-12,FALSE,FALSE,FALSE,FALSE,FALSE,FALSE
"Kruger 2 Canyons BR","Klaserie Site 1","Klaserie","Site 1","sunny","","",3.66,17.8,"08/12/2024 13:37",NA,NA,NA,NA,NA,74.1,6.39,"pH reading indicates the water is NOT suitable for irrigation",NA,-24.6060883,30.9701533,683.3,4,2024-08-12 13:37:00,2024-08-12,FALSE,FALSE,FALSE,FALSE,FALSE,FALSE
"Kruger 2 Canyons BR","Klaserie Site 2","Klaserie","Site 2","sunny","","",1.73,NA,"08/12/2024 13:44",NA,NA,NA,NA,NA,74.8,6.32,"pH reading indicates the water is NOT suitable for irrigation",18.1,-24.6044258,30.9729339,669.1,3.214,2024-08-12 13:44:00,2024-08-12,FALSE,FALSE,FALSE,FALSE,FALSE,FALSE
"Kruger 2 Canyons BR","Klaserie Site 3","Klaserie","Site 3","sunny","","",NA,NA,"08/12/2024 14:17",NA,NA,NA,NA,NA,NA,NA,"pH reading indicates the water is NOT suitable for irrigation",18.1,-24.6043896,30.9753597,676.5,4.6,2024-08-12 14:17:00,2024-08-12,FALSE,FALSE,FALSE,FALSE,FALSE,FALSE
"Kruger 2 Canyons BR","Klaserie Site 3","Klaserie","Site 3","sunny","","",7.62,NA,"08/12/2024 14:23",NA,NA,NA,NA,NA,75.2,6.3,"pH reading indicates the water is NOT suitable for irrigation",18.1,-24.6043896,30.9753597,676.5,4.6,2024-08-12 14:23:00,2024-08-12,FALSE,FALSE,FALSE,FALSE,FALSE,FALSE
"Kruger 2 Canyons BR","Moetladimo Site 1","Moetladimo","Site 1","partly_cloudy","","",NA,113.12,"08/13/2024 09:44",NA,NA,NA,NA,NA,114.5,8.48,"pH reading indicates the water is suitable for irrigation",20.8,-24.2586254,30.4538332,633.3,4.966,2024-08-13 09:44:00,2024-08-13,FALSE,FALSE,FALSE,FALSE,FALSE,FALSE
"Kruger 2 Canyons BR","Moetladimo Moe001 US","Moetladimo","Moe001 US","cloudy","","",NA,112.92,"08/13/2024 09:48",NA,NA,NA,NA,NA,128.1,7.53,"pH reading indicates the water is suitable for irrigation",18.5,-24.2663018,30.4493477,611.2,4.133,2024-08-13 09:48:00,2024-08-13,FALSE,FALSE,FALSE,FALSE,FALSE,FALSE
"Kruger 2 Canyons BR","Blyde river Blyde river","Blyde river","Blyde river","sunny","","",8.14,16.1,"08/14/2024 07:53",NA,NA,NA,NA,NA,177.5,8.14,"pH reading indicates the water is suitable for irrigation",16.5,-24.68009167,30.80184667,1095,2.4,2024-08-14 07:53:00,2024-08-14,FALSE,FALSE,FALSE,FALSE,FALSE,FALSE
"Kruger 2 Canyons BR","Blyde river Blyde river","Blyde river","Blyde river","sunny","","",10.22,123.69,"08/14/2024 08:33",NA,NA,NA,NA,NA,175,8,"pH reading indicates the water is suitable for irrigation",16.3,-24.67898667,30.80246833,1107.4,4.1,2024-08-14 08:33:00,2024-08-14,FALSE,FALSE,FALSE,FALSE,FALSE,FALSE
"Kruger 2 Canyons BR","Marakalala Site 1","Marakalala","Site 1","sunny","","",63.5,NA,"08/08/2024 10:50",NA,NA,NA,NA,NA,450,NA,"pH reading indicates the water is NOT suitable for irrigation",16.8,-24.52278229,30.70724087,851.2382191,4.9,2024-08-08 10:50:00,2024-08-08,FALSE,TRUE,FALSE,FALSE,FALSE,TRUE
"Kruger 2 Canyons BR","Treur River Site 2","Treur River","Site 2","sunny","","",9.94,120.31,"08/15/2024 07:54",NA,NA,NA,NA,NA,61.2,8.03,"pH reading indicates the water is suitable for irrigation",13.5,-24.68763333,30.81268833,1290.7,3.6,2024-08-15 07:54:00,2024-08-15,FALSE,FALSE,FALSE,FALSE,FALSE,FALSE
